Câmara dos Deputados;;;;;;;;
"Relatório de Proposições
Resultado da Pesquisa";;;;;;;;
Proposições;Ementa;Explicação ;Autor;UF;Partido;Apresentaç;Situação;Link 
PL 3391/2019;Altera a Lei n. 8.080, de 19 de setembro de 1990, que dispõe sobre as condições para a promoção, proteção e recuperação da saúde, para dispor sobre a prioridade na assistência psicológica às mulheres que sofreram aborto espontâneo, nos casos permitidos em Lei ou na ocorrência de óbito perinatal;;Fábio Faria;RN;PSD;06/06/2019;Aguardando Parecer;/proposicoesWeb/fichadetramitacao?idProposicao=2207082
PL 3553/2020;Institui diretrizes para serviços de proteção e atendimento especializado a gestantes dependentes químicas a serem criados no âmbito da Proteção Especial da Assistência Social, e dá outras providências .;;Marreca Filho;MA;PATRIOTA;30/06/2020;Aguardando Despacho do Presidente da Câmara dos Deputados;/proposicoesWeb/fichadetramitacao?idProposicao=2256414
PL 1009/2019;Altera o Decreto-Lei nº 2.848, de 1940.;;Capitão Augusto;SP;PR;21/02/2019;Tramitando em Conjunto;/proposicoesWeb/fichadetramitacao?idProposicao=2192659
PL 3050/2011;Altera o §2º do art. 10 da Lei 9.263, de 12 de janeiro de 1996, que trata do planejamento familiar, de forma a permitir a realização da laqueadura tubárea nos períodos de parto ou aborto em caso de cesária anterior.;;Aguinaldo Ribeiro;PB;PP;21/12/2011;Tramitando em Conjunto;/proposicoesWeb/fichadetramitacao?idProposicao=533044
PL 5069/2013;Acrescenta o art. 127-A ao Decreto-Lei nº 2.848, de 7 de dezembro de 1940 - Código Penal.;Tipifica como crime contra a vida o anúncio de meio abortivo e prevê penas específicas para quem induz a gestante à prática de aborto.;"Eduardo Cunha;Isaias Silvestre;João Dado;Andre Moura;Arolde de Oliveira;Padre Ton;Arnaldo Faria de Sá;Aureo;Lincoln Portela;João Campos;Roberto de Lucena;Marcos Rogério;José Linhares";"RJ;MG;SP;SE;RJ;RO;SP;RJ;MG;GO;SP;RO;CE";"PMDB;PSB;PDT;PSC;PSD;PT;PTB;PRTB;PR;PSDB;PV;PDT;PP";27/02/2013;Pronta para Pauta;/proposicoesWeb/fichadetramitacao?idProposicao=565882
PL 1545/2011;Inclui art. 128-A no Decreto-Lei nº 2.848, de 07 de dezembro de 1940.;Tipifica o crime de aborto praticado por médico quando não for os tipos admitidos no Código Penal: necessário ou quando a gravidez resultante de estupro (sentimental).;Eduardo Cunha;RJ;PMDB;08/06/2011;Aguardando Parecer;/proposicoesWeb/fichadetramitacao?idProposicao=507573
PL 8363/2017;Dispõe sobre o exercício profissional da atividade de Doula e dá outras providências.;;Erika Kokay;DF;PT;23/08/2017;Aguardando Designação de Relator;/proposicoesWeb/fichadetramitacao?idProposicao=2148936
PL 4640/2016;Altera a Lei 8.069 de 13 de Julho de 1990, para assegurar à mulher o direito à escolha da família substituta na hipótese de entrega consciente para adoção e cria Campanha Nacional de conscientização sobre a entrega voluntária de bebes para adoção.;;Flavinho;SP;PSB;08/03/2016;"Tramitando em Conjunto;Tramitando em Conjunto";/proposicoesWeb/fichadetramitacao?idProposicao=2078892
PL 4808/2016;Altera o Decreto-Lei nº 667, de 2 de julho de 1969, que reorganiza as Polícias Militares e os Corpos de Bombeiros Militares dos Estados, dos Territórios e do Distrito Federal.;Trata dos critérios de concessão da licença maternidade e licença paternidade aos militares dos Estados e do Distrito Federal.;Capitão Augusto;SP;PR;22/03/2016;Aguardando Designação - Aguardando Devolução de Relator que deixou de ser Membro;/proposicoesWeb/fichadetramitacao?idProposicao=2080269
RIC 113/2020;"Solicita à Ministra de Estado da Mulher, da Família e dos Direitos Humanos esclarecimentos acerca da campanha ""Adolescência primeiro, gravidez depois - tudo tem o seu tempo"".";;Sâmia Bomfim;SP;PSOL;17/02/2020;"Aguardando Remessa ao Arquivo;Aguardando Deliberação";/proposicoesWeb/fichadetramitacao?idProposicao=2237605
PL 3983/2015;Altera o artigo 128 do Decreto Lei 2.848 de 7 de dezembro de 1940 (Código Penal).;;"Givaldo Carimbão;Gorete Pereira;Flavinho;Diego Garcia;Joaquim Passarinho;Carlos Gomes;Valtenir Pereira;Sóstenes Cavalcante;Jefferson Campos;Izalci;Roney Nemer;Eros Biondini;Professor Victório Galli";"AL;CE;SP;PR;PA;RS;MT;RJ;SP;DF;DF;MG;MT";"PROS;PR;PSB;PHS;PSD;PRB;PMB;PSD;PSD;PSDB;PMDB;PTB;PSC";15/12/2015;Tramitando em Conjunto;/proposicoesWeb/fichadetramitacao?idProposicao=2074902
PL 2893/2019;Revoga o art. 128 do Decreto-Lei nº 2.848, de 7 de dezembro de 1940 (Código Penal).;Revoga dispositivo que trata do aborto necessário e do aborto em caso de estupro.;"Chris Tonietto;Filipe Barros";"RJ;PR";"PSL;PSL";15/05/2019;Aguardando Pendências;/proposicoesWeb/fichadetramitacao?idProposicao=2203415
PDL 251/2020;"Susta os efeitos da Nota Técnica nº 16/2020- COSMU/CGCIVI/DAPES/SAPS/MS, do Ministério da Saúde, a qual tem como referência o ""acesso à saúde sexual e saúde reprodutiva no contexto da pandemia da COVID-19"".";;Dr. Jaziel;CE;PL;04/06/2020;Aguardando Autorização Devolução;/proposicoesWeb/fichadetramitacao?idProposicao=2254498
PL 7633/2014;Dispõe sobre a humanização da assistência à mulher e ao neonato durante o ciclo gravídico-puerperal e dá outras providências.;;Jean Wyllys;RJ;PSOL;29/05/2014;Tramitando em Conjunto;/proposicoesWeb/fichadetramitacao?idProposicao=617546
PL 6055/2013;"Revoga-se a Lei nº 12.845, de 1º de agosto de 2013, que ""dispõe sobre o atendimento obrigatório e integral, às pessoas vítimas de violência sexual"".";;"Pastor Eurico;Costa Ferreira;Pastor Marco Feliciano;João Dado;Leonardo Quintão;Dr. Grilo;Zequinha Marinho;Alfredo Kaefer;Henrique Afonso;William Dib;Jair Bolsonaro;Otoniel Lima;Eurico Júnior";"PE;MA;SP;SP;MG;MG;PA;PR;AC;SP;RJ;SP;RJ";"PSB;PSC;PSC;PDT;PMDB;PSL;PSC;PSDB;PV;PSDB;PP;PRB;PV";07/08/2013;Tramitando em Conjunto;/proposicoesWeb/fichadetramitacao?idProposicao=586417
PL 1945/2020;Altera dispositivo do Decreto-Lei nº 2.848, de 7 de dezembro de 1940 (Código Penal), para fins de inclusão de causa de aumento de pena em caso de aborto realizado em razão de microcefalia ou qualquer outra anomalia ou malformação do feto.;;Chris Tonietto;RJ;PSL;16/04/2020;Aguardando Autorização do Despacho;/proposicoesWeb/fichadetramitacao?idProposicao=2249319
INC 626/2020;"Envia Indicação ao Sr. Ministro da Saúde, sugerindo a revogação da NOTA TÉCNICA Nº 16/2020 -COSMU/CGCIVI/DAPES/SAPS/MS, que trata do ""acesso à saúde sexual e saúde reprodutiva no contexto da pandemia da COVID-19"".";;Chris Tonietto;RJ;PSL;03/06/2020;Aguardando Resposta;/proposicoesWeb/fichadetramitacao?idProposicao=2254491
REQ 1469/2020;Requer o comparecimento do Sr. Eduardo Pazuello, Ministro interino da Saúde, para prestar esclarecimentos acerca dos motivos da exoneração do corpo técnico da Coordenação de Saúde das Mulheres, da Coordenação-Geral de Ciclos da Vida e da revogação da nota técnica 16/2020 .COSMU/CGCIVI/DAPES/SAPS/MS, que visava garantir o acesso à saúde sexual e saúde reprodutiva em tempos da pandemia da COVID-19.;;"Fernanda Melchionna ;Edmilson Rodrigues ;Sâmia Bomfim ;David Miranda ;Áurea Carolina ;Ivan Valente ;Marcelo Freixo ;Luiza Erundina ;Glauber Braga";"RS;PA;SP;RJ;MG;SP;RJ;SP;RJ";"PSOL;PSOL;PSOL;PSOL;PSOL;PSOL;PSOL;PSOL;PSOL";08/06/2020;Aguardando Despacho do Presidente da Câmara dos Deputados;/proposicoesWeb/fichadetramitacao?idProposicao=2254773
PL 580/2020;Inclui a alínea e ao inciso I do art. 7º do Decreto-Lei nº 2.848, de 7 de dezembro de 1940 (Código Penal), a fim de prever a aplicação da extraterritorialidade incondicionada aos crimes dolosos contra a vida, quando o agente for brasileiro ou domiciliado no Brasil.;;Chris Tonietto;RJ;PSL;09/03/2020;;/proposicoesWeb/fichadetramitacao?idProposicao=2238602
PL 581/2020;Altera o Decreto-Lei nº 2.848, de 7 de dezembro de 1940 (Código Penal), a fim de dispor sobre a imprescritibilidade dos crimes dolosos contra a vida.;;Chris Tonietto;RJ;PSL;09/03/2020;;/proposicoesWeb/fichadetramitacao?idProposicao=2238604
PL 4149/2019;Institui a Semana Nacional do Nascituro.;;Chris Tonietto;RJ;PSL;18/07/2019;Tramitando em Conjunto;/proposicoesWeb/fichadetramitacao?idProposicao=2212577
PL 260/2019;Dispõe sobre a proibição do aborto.;;Márcio Labre;RJ;PSL;04/02/2019;Tramitando em Conjunto;/proposicoesWeb/fichadetramitacao?idProposicao=2190788
PL 1085/2011;Dispõe sobre a assistência para a mulher vítima de estupro que vier a optar por realizar aborto legal.;Concede bolsa-auxílio à mulher que engravidar em decorrência de estupro e optar por realizar aborto legal ou que sofrer aborto espontâneo.;Cleber Verde;MA;PRB;14/04/2011;Tramitando em Conjunto;/proposicoesWeb/fichadetramitacao?idProposicao=498623
PL 7122/2017;Dispõe sobre a concessão de licença e de salário-maternidade nos casos de aborto não criminoso e de nascimento de bebê natimorto.;Altera o Decreto-Lei nº 5.452, de 1943 e a Lei nº 8.213, de 1991.;Luciano Ducci;PR;PSB;15/03/2017;"Tramitando em Conjunto;Tramitando em Conjunto;Tramitando em Conjunto";/proposicoesWeb/fichadetramitacao?idProposicao=2125614
PL 9696/2018;Altera a Lei nº 8.213, de 24 de julho de 1991 e o Decreto-Lei nº 5.452, de 1º de maio de 1943 para dispor sobre a licença maternidade em caso de natimorto ou de aborto não criminoso.;;José Guimarães;CE;PT;06/03/2018;"Tramitando em Conjunto;Tramitando em Conjunto;Tramitando em Conjunto";/proposicoesWeb/fichadetramitacao?idProposicao=2168783
PL 7283/2010;Altera o caput do art. 468 do Decreto-Lei nº 3.689, de 3 de outubro de 1941 - Código de Processo Penal, relativo ao Tribunal do Júri.;;Carlos Bezerra;MT;PMDB;11/05/2010;Tramitando em Conjunto;/proposicoesWeb/fichadetramitacao?idProposicao=476189
PL 1526/2019;Altera o Decreto-Lei nº 2.848, de 7 de dezembro de 1940 (Código Penal) para qualificar o crime de lesão corporal quando grave e cometido contra mulher por menosprezo ou discriminação à condição de mulher e, ainda, qualificar o crime de ameaça quando cometida contra mulher por razões da condição de sexo feminino.;;Dr. Leonardo;MT;SOLIDARI;19/03/2019;Tramitando em Conjunto;/proposicoesWeb/fichadetramitacao?idProposicao=2194283
REQ 380/2020;Requer a realização de sessão solene no dia 13 de março de 2020, no Plenário desta Casa, em homenagem ao Dia Internacional da Mulher.;;Erika Kokay;DF;PT;05/03/2020;Aguardando Despacho do Presidente da Câmara dos Deputados;/proposicoesWeb/fichadetramitacao?idProposicao=2238507
PL 3319/2019;Altera a Lei nº 9.263, de 12 de janeiro de 1996, para tornar obrigatória a realização do exame, em gestantes, para a detecção da trombofilia nos serviços de saúde do SUS.;;Marco Bertaiolli;SP;PSD;04/06/2019;Tramitando em Conjunto;/proposicoesWeb/fichadetramitacao?idProposicao=2206510
PRL 5 CSSF => PL 8363/2017;Parecer da Relatora, Dep. Benedita da Silva (PT-RJ), pela aprovação do PL 8363/2017 e pela aprovação parcial da Emenda nº 4 ao Substitutivo na forma do Substitutivo e pela rejeição das Emendas nº 01, 02, 03 e 05 ao Substitutivo.;;Benedita da Silva;RJ;PT;30/10/2019;;/proposicoesWeb/fichadetramitacao?idProposicao=2227530
REQ 259/2020;"Requer a convocação de Sessão Solene da Câmara dos Deputados para homenagear a Campanha da Fraternidade de 2020, com o tema ""Fraternidade e vida: dom e compromisso"" e o lema ""Viu, sentiu compaixão e cuidou dele"", realizada pela Conferência Nacional dos Bispos do Brasil (CNBB).";;Bira do Pindaré;MA;PSB;18/02/2020;Aguardando Despacho do Presidente da Câmara dos Deputados;/proposicoesWeb/fichadetramitacao?idProposicao=2237746
REQ 248/2020;Requer a criação de Comissão Especial para estudo das razões do aumento de denúncias de violência obstétrica e a alta taxa de morte materna no Brasil.;;Soraya Santos;RJ;PL;17/02/2020;;/proposicoesWeb/fichadetramitacao?idProposicao=2237674
PL 5799/2019;Modifica o art. 2º da Lei nº 10.406, de 10 de janeiro de 2002, para estabelecer o início da personalidade civil com a concepção do embrião vivo.;;Abílio Santana;BA;PL;31/10/2019;Tramitando em Conjunto;/proposicoesWeb/fichadetramitacao?idProposicao=2227835
PL 2509/2019;Altera o art. 18 da Lei nº 13.301 de 26 de junho de 2016, para garantir o acesso ao benefício de prestação continuada da Lei no 8.742, de 7 de dezembro de 1993 por crianças e adolescentes vítimas de microcefalia, síndrome congênita do zika ou outras alterações no crescimento e desenvolvimento relacionadas a etiologias infecciosas transmitidas pelo Aedes aegypti e dá outras providências.;;Natália Bonavides;RN;PT;24/04/2019;Tramitando em Conjunto;/proposicoesWeb/fichadetramitacao?idProposicao=2199214
INC 1293/2019;Sugere ao Poder Executivo a apresentação de novo Plano Nacional de Direitos Humanos.;;Luiz Philippe de Orleans e Bragança;SP;PSL;04/09/2019;Aguardando Remessa ao Arquivo;/proposicoesWeb/fichadetramitacao?idProposicao=2218846
PL 9432/2017;Altera dispositivos do Decreto-lei nº 1.001, de 21 de outubro de 1969 - Código Penal Militar e o art.1º da Lei nº 8.072, de 25 de julho de 1990.;;RELAÇÕES EXTERIORES E DE DEFESA NACIONAL;;;19/12/2017;Pronta para Pauta;/proposicoesWeb/fichadetramitacao?idProposicao=2166877
PL 4642/2016;Dispõe sobre a prevenção e conscientização dos riscos e consequências relacionados ao aborto.;;Flavinho;SP;PSB;08/03/2016;Aguardando Parecer;/proposicoesWeb/fichadetramitacao?idProposicao=2078898
PL 2084/2019;Torna obrigatória a participação de, no mínimo, 30% (trinta por cento) de mulheres na composição de entidades de representação civil.;;Soraya Santos;RJ;PR;04/04/2019;Pronta para Pauta;/proposicoesWeb/fichadetramitacao?idProposicao=2197029
PL 10569/2018;Dispõe sobre a afixação de placas informativas, nas unidades públicas e privadas de saúde, sobre a adoção de nascituro.;Altera a Lei nº 8.069, de 1990.;Herculano Passos;SP;MDB;11/07/2018;"Tramitando em Conjunto;Tramitando em Conjunto";/proposicoesWeb/fichadetramitacao?idProposicao=2181531
REQ 3059/2019;Requer a realização de Sessão Solene em homenagem ao Pró-vida de Anápolis.;;Chris Tonietto;RJ;PSL;27/11/2019;Aguardando Despacho do Presidente da Câmara dos Deputados;/proposicoesWeb/fichadetramitacao?idProposicao=2230835
PL 3667/2015;Modifica dispositivo do Código Nacional de Trânsito para modificar as penas dos crimes de homicídio e lesão corporal na direção de veículo automotor.;Altera a Lei nº 9.503, de 1997.;Shéridan;RR;PSDB;18/11/2015;Tramitando em Conjunto;/proposicoesWeb/fichadetramitacao?idProposicao=2055700
SBT-A 1 CCJC => PL 9432/2017;Substitutivo adotado pela CCJC ao PL 9432/2017.;;CONSTITUIÇÃO E JUSTIÇA E DE CIDADANIA;;;26/11/2019;;/proposicoesWeb/fichadetramitacao?idProposicao=2230569
REL 1/2019 SUBMULH;Relatório da Subcomissão Especial de Seguridade da Mulher na Comissão de Seguridade Social e Família.;;Marília Arraes;PE;PT;05/11/2019;;/proposicoesWeb/fichadetramitacao?idProposicao=2228353
PRL 2 CCJC => PL 9432/2017;Parecer do Relator, Dep. General Peternelli (PSL-SP), pela constitucionalidade, juridicidade e técnica legislativa e, no mérito, pela aprovação, com substitutivo.;;General Peternelli;SP;PSL;31/10/2019;;/proposicoesWeb/fichadetramitacao?idProposicao=2227983
SBT 2 CCJC => PL 9432/2017;Altera dispositivos do Decreto-Lei nº 1.001, de 21 de outubro de 1969 - Código Penal Militar, e o art. 1º da Lei nº 8.072, de 25 de julho de 1990, que dispõe sobre os crimes hediondos;;General Peternelli;SP;PSL;31/10/2019;;/proposicoesWeb/fichadetramitacao?idProposicao=2227985
PRL 1 CSSF => PL 978/2019;Parecer da Relatora, Dep. Erika Kokay (PT-DF), pela aprovação.;;Erika Kokay;DF;PT;29/10/2019;;/proposicoesWeb/fichadetramitacao?idProposicao=2227333
PRL 4 CSSF => PL 6022/2013;Parecer do Relator, Dep. Jorge Solla (PT-BA), pela aprovação deste, e dos PLs 8.931/2017, 2.398/2019, 2.916/2019, e 1.590/2019, apensados, com substitutivo, e pela rejeição dos PLs 6.033/2013, 6.061/2013, e 6.055/2013, apensados e das Emendas 1, 2 e 3.;;Jorge Solla;BA;PT;24/10/2019;;/proposicoesWeb/fichadetramitacao?idProposicao=2227081
INC 910/2019;Sugere a informação sobre riscos e consequências do aborto em materiais informativos, didáticos ou de qualquer natureza, editados ou fiscalizados pelo Poder Público;;Diego Garcia;PR;PODE;17/06/2019;Aguardando Resposta;/proposicoesWeb/fichadetramitacao?idProposicao=2208243
REQ 36/2019 CMULHER;Requer a realização de audiência pública conjunta de Defesa dos Direitos da Mulher e Comissão de Seguridade Social e Família acerca dos fluxos de atendimento em casos de interrupção da gravidez.;;Sâmia Bomfim;SP;PSOL;25/06/2019;Pronta para Pauta;/proposicoesWeb/fichadetramitacao?idProposicao=2209207
REQ 1983/2019;Requer a criação da Frente Parlamentar Mista contra o Aborto e em Defesa da Vida;;Chris Tonietto;RJ;PSL;16/07/2019;;/proposicoesWeb/fichadetramitacao?idProposicao=2212376
PL 1522/2015;Altera o art. 395 da Consolidação das Leis do Trabalho - CLT, para assegurar a garantia de emprego contra dispensa arbitrária ou sem justa causa à trabalhadora em caso de aborto não criminoso.;Altera o Decreto-lei nº 5.452, de 1943.;Luciano Ducci;PR;PSB;13/05/2015;Tramitando em Conjunto;/proposicoesWeb/fichadetramitacao?idProposicao=1266746
PL 6244/2016;Altera a Lei 8.080, de 19 de setembro de 1990.;Trata da designação de locais de internação diferentes das demais puérperas para mulheres cuja gravidez resultou em aborto, morte fetal ou perinatal.;Rômulo Gouveia;PB;PSD;05/10/2016;Pronta para Pauta;/proposicoesWeb/fichadetramitacao?idProposicao=2113091
PL 3649/2019;Estabelece aos hospitais públicos e privados instituírem procedimentos relacionados a humanização do luto materno e parental.;Altera a Lei nº 8.069, de 1990 e a Lei nº 6.015, de 1973.;Carmen Zanotto;SC;CIDADANIA;19/06/2019;Tramitando em Conjunto;/proposicoesWeb/fichadetramitacao?idProposicao=2208715
PL 7867/2017;Dispõe sobre medidas de proteção contra a violência obstétrica e de divulgação de boas práticas para a atenção à gravidez, parto, nascimento, abortamento e puerpério.;;Jô Moraes;MG;PCdoB;13/06/2017;Tramitando em Conjunto;/proposicoesWeb/fichadetramitacao?idProposicao=2141402
VTS 1 CCJC => PL 4754/2016;Altera a redação do art. 39 da lei 1.079, de 10 de abril de 1950. Tipifica crime de responsabilidade dos Ministros do Supremo Tribunal Federal a usurpação de competência do Poder Legislativo ou do Poder Executivo.;;Talíria Petrone;RJ;PSOL;09/07/2019;;/proposicoesWeb/fichadetramitacao?idProposicao=2211362
VTS 1 CCJC => PL 6448/2009;Acresce dispositivo na Lei nº 8.078, de 11 de setembro de 1990, dispondo sobre a rotulagem de produtos alimentares.;;Talíria Petrone;RJ;PSOL;09/07/2019;;/proposicoesWeb/fichadetramitacao?idProposicao=2211361
PRL 3 CSSF => PL 4642/2016;Parecer do Relator, Dep. Diego Garcia (PODE-PR), pela aprovação deste, e do PL 5617/2016, apensado, com substitutivo.;;Diego Garcia;PR;PODE;28/06/2019;;/proposicoesWeb/fichadetramitacao?idProposicao=2209922
REQ 58/2019 CDHM;Requer a realização de Seminário conjunto com a Comissão de Defesa dos Direitos das Pessoas com Deficiência, Comissão de Defesa dos Direitos da Mulher, Comissão de Direitos Humanos e Minorias, Comissão de Seguridade Social e Família e com o Ministério da Mulher, da Família e dos Direitos Humanos sobre MÃES DE CRIANÇAS COM MICROCEFALIA: ENTENDENDO OS DESAFIOS E SUPERANDO O PRECONCEITO.;;Sóstenes Cavalcante;RJ;DEM;07/05/2019;Aguardando Providências Internas;/proposicoesWeb/fichadetramitacao?idProposicao=2200212
REQ 57/2019 CDHM;"""Requer a realização de Audiência Pública para discutir a ADI 5581, que pretende permitir o aborto em caso de fetos gestados por mães infectados pelo vírus zika"".";;Filipe Barros;PR;PSL;07/05/2019;Aguardando Providências Internas;/proposicoesWeb/fichadetramitacao?idProposicao=2200080
PRL 3 CCJC => PL 4754/2016;Parecer da Relatora, Dep. Chris Tonietto (PSL-RJ), pela constitucionalidade, juridicidade e técnica legislativa e, no mérito, pela aprovação deste e do PL 1182/2019, apensado, com substitutivo.;;Chris Tonietto;RJ;PSL;25/06/2019;;/proposicoesWeb/fichadetramitacao?idProposicao=2209260
PRL 2 CSSF => PL 4642/2016;Parecer do Relator, Dep. Diego Garcia (PODE-PR), pela aprovação deste, e do PL 5617/2016, apensado, com substitutivo.;;Diego Garcia;PR;PODE;14/06/2019;;/proposicoesWeb/fichadetramitacao?idProposicao=2208178
PL 6405/2016;Inscreve os nomes de D. Maria Leopoldina e D. Isabel Christina Leopoldina Augusta no Livro dos Heróis e Heroínas da Pátria.;;DEFESA DOS DIREITOS DA MULHER;;;25/10/2016;Aguardando Parecer;/proposicoesWeb/fichadetramitacao?idProposicao=2115459
PRL 2 CCJC => PL 4754/2016;Parecer da Relatora, Dep. Chris Tonietto (PSL-RJ).;;Chris Tonietto;RJ;PSL;25/06/2019;;/proposicoesWeb/fichadetramitacao?idProposicao=2209043
PRL 1 CSSF => PL 4642/2016;Parecer do Relator, Dep. Diego Garcia (PODE-PR), pela aprovação deste, e do PL 5617/2016, apensado, com substitutivo, e pelo encaminhamento de Indicação ao Poder Executivo.;;Diego Garcia;PR;PODE;12/06/2019;;/proposicoesWeb/fichadetramitacao?idProposicao=2207683
SBT 1 CSSF => PL 4642/2016;Dispõe sobre a prevenção e conscientização dos riscos e consequências relacionados ao aborto.;;Diego Garcia;PR;PODE;12/06/2019;;/proposicoesWeb/fichadetramitacao?idProposicao=2207684
PRL 1 CMULHER => PL 978/2019;Parecer da relatora, Dep. Erika Kokay, pela aprovação.;;Erika Kokay;DF;PT;12/06/2019;;/proposicoesWeb/fichadetramitacao?idProposicao=2207744
SBT 2 CSSF => PL 8363/2017;Dispõe sobre o exercício profissional da atividade de Doula e dá outras providências.;;Benedita da Silva;RJ;PT;13/06/2019;;/proposicoesWeb/fichadetramitacao?idProposicao=2207950
SBT 2 CSSF => PL 4642/2016;Dispõe sobre a prevenção e conscientização dos riscos e consequências relacionados ao aborto.;;Diego Garcia;PR;PODE;14/06/2019;;/proposicoesWeb/fichadetramitacao?idProposicao=2208179
PL 6061/2013;"Altera a Lei nº 12.845, de 1º de agosto de 2013, que ""Dispõe sobre o atendimento obrigatório e integral de pessoas em situação de violência sexual"" e dá outras providências.";;Hugo Leal;RJ;PSC;08/08/2013;Tramitando em Conjunto;/proposicoesWeb/fichadetramitacao?idProposicao=586481
REQ 841/2019;REQUER O REGISTRO DA FRENTE PARLAMENTAR MISTA DE COMBATE ÀS HEPATITES VIRAIS;;Júnior Bozzella;SP;PSL;19/03/2019;;/proposicoesWeb/fichadetramitacao?idProposicao=2194495
REQ 1/2019 CMULHER;Requer a realização de Audiência Pública para discutir o PL 478/2007, que dispõe sobre o Estatuto do Nascituro e dá outras providências.;;Diego Garcia;PR;PODE;14/03/2019;Pronta para Pauta;/proposicoesWeb/fichadetramitacao?idProposicao=2193951
PL 6395/2016;Altera a lei nº 9.294, de 15 de julho de 1996, que dispõe sobre as restrições ao uso e à propaganda de produtos fumígeros, bebidas alcoólicas, medicamentos, terapias e defensivos agrícolas, nos termos do § 4° do art. 220 da Constituição Federal.;Estabelece que no rótulo de bebidas alcoólicas deve constar informação de que o produto não é aconselhável à gestante e lactante.;Flavinho;SP;PSB;25/10/2016;Tramitando em Conjunto;/proposicoesWeb/fichadetramitacao?idProposicao=2115375
PL 882/2015;Estabelece as políticas públicas no âmbito da saúde sexual e dos direitos reprodutivos e dá outras providências.;Altera o Decreto-lei nº 2.848, de 1940.;Jean Wyllys;RJ;PSOL;24/03/2015;Tramitando em Conjunto;/proposicoesWeb/fichadetramitacao?idProposicao=1050889
PL 891/2015;Estabelece as políticas públicas no âmbito da saúde sexual e dos direitos reprodutivos e dá outras providências.;;Flavinho;SP;PSB;24/03/2015;Tramitando em Conjunto;/proposicoesWeb/fichadetramitacao?idProposicao=1105078
PL 7485/2017;Altera a Lei 8.069, de 13 de julho de 1990.;Trata da designação de locais de internação diferentes das demais puérperas para mulheres cuja gravidez resultou em aborto, morte fetal ou perinatal.;Chico D'Angelo;RJ;PT;25/04/2017;Tramitando em Conjunto;/proposicoesWeb/fichadetramitacao?idProposicao=2131073
PL 5941/2016;Altera a Lei nº 10.098, de 19 de dezembro de 2000, para dispor sobre a reserva de vagas para gestantes e pessoas com crianças pequenas nos estacionamentos públicos ou privados.;;Carlos Bezerra;MT;PMDB;09/08/2016;Tramitando em Conjunto;/proposicoesWeb/fichadetramitacao?idProposicao=2093236
SBT 2 CCJC => PL 7585/2010;"Acrescenta dispositivos à Lei 9.096, de 19 de setembro de 1995, que ""dispõe sobre partidos políticos, regulamenta os arts. 17 e 14, § 3º, inciso V, da Constituição Federal"", para estabelecer regras de fidelidade ao programa do partido.";;Rodrigo Pacheco;MG;DEM;19/12/2018;;/proposicoesWeb/fichadetramitacao?idProposicao=2189951
SBT 1 CSSF => PL 8363/2017;Dispõe sobre o exercício profissional da atividade de Doula e dá outras providências;;Benedita da Silva;RJ;PT;13/06/2018;;/proposicoesWeb/fichadetramitacao?idProposicao=2178845
PRL 2 CMULHER => PL 4641/2016;Parecer da Relatora, Dep. Gorete Pereira, pela aprovação, com Substitutivo.;;Gorete Pereira;CE;PR;13/06/2018;;/proposicoesWeb/fichadetramitacao?idProposicao=2178863
PRL 3 CSSF => PL 7559/2014;Parecer do Relator, Dep. Pompeo de Mattos (PDT-RS), pela aprovação, com substitutivo.;;Pompeo de Mattos;RS;PDT;16/05/2018;;/proposicoesWeb/fichadetramitacao?idProposicao=2175256
SBT 1 CSSF => PL 6022/2013;Altera a Lei nº 12.845, de 1º de agosto de 2013, que dispõe sobre o atendimento obrigatório e integral de pessoas em situação de violência sexual.;;Jorge Solla;BA;PT;03/05/2018;;/proposicoesWeb/fichadetramitacao?idProposicao=2173892
