Câmara dos Deputados;;;;;;;;
PRL 1 CCJC => PL 478/2007;Parecer do Relator, Dep. Marcos Rogério (DEM-RO).;;Marcos Rogério;RO;DEM;31/05/2017;;/proposicoesWeb/fichadetramitacao?idProposicao=2139826
PRL 1 CMULHER => PL 5687/2016;Parecer da relatora, Dep. Shéridan, pela rejeição.;;Shéridan;RR;PSDB;15/05/2017;;/proposicoesWeb/fichadetramitacao?idProposicao=2137373
PRL 1 CPD => PL 7435/2017;Parecer da Relatora, Dep. Mara Gabrilli (PSDB-SP), pela aprovação do PL nº 7.435/2017.;;Mara Gabrilli;SP;PSDB;26/06/2017;;/proposicoesWeb/fichadetramitacao?idProposicao=2142384
SBT 1 PEC18115 => PEC 181/2015;COMISSÃO ESPECIAL DESTINADA A PROFERIR PARECER À PROPOSTA DE EMENDA À CONSTITUIÇÃO Nº 181-A, DE 2015, DO SENADO FEDERAL, QUE ?ALTERA A REDAÇÃO DO INCISO XVIII DO ART. 7º DA CONSTITUIÇÃO FEDERAL PARA DISPOR SOBRE LICENÇA-MATERNIDADE EM CASO DE PARTO PREMATURO?. PROPOSTA DE EMENDA À CONSTITUIÇÃO No 181-A, DE 2015 (Apensa a PEC Nº 58-A, DE 2011) Altera a redação do inciso XVIII do artigo 7º da Constituição Federal para dispor sobre a licença-maternidade em caso de parto ...;;Jorge Tadeu Mudalen;SP;DEM;15/08/2017;;/proposicoesWeb/fichadetramitacao?idProposicao=2147923
SBT 5 CSSF => PL 626/2011;Acrescenta parágrafo ao art. 8º Lei nº 8.069 de 13 de julho de 1990 - Estatuto da Criança e do Adolescente para garantir atendimento ambulatorial e psicológico à menor gestante.;;Flávia Morais;GO;PDT;06/04/2018;;/proposicoesWeb/fichadetramitacao?idProposicao=2171084
Fonte:;Sistema ;;;;;;;
Data/Ho;13/09/2020 ;;;;;;;
Total de ;173;;;;;;;
