Câmara dos Deputados;;;;;;;;
ESB 136 PL803510 => SBT 1 PL803510 => PL 8035/2010;"Modifique-se a Meta 1 do Anexo do Substitutivo ao Projeto de Lei nº 8.035, de 2010, e dê-se a seguinte redação: ""Meta 1: Universalizar, até 2016, o atendimento escolar da população de quatro e cinco anos, e ampliar a oferta de educação infantil de forma a atender, no mínimo, aos seguintes percentuais da população de até três anos: trinta por cento até o quinto ano de vigência deste PNE e cinquenta por cento dessa população até o último ano e os outros cinquenta por cento por meio de programas de ...";;Nelson Marchezan Junior;RS;PSDB;14/12/2011;;/proposicoesWeb/fichadetramitacao?idProposicao=531775
PRL 1 CTASP => PL 1164/2011;Parecer do Relator, Dep. Pedro Henry, pela rejeição deste, do Substitutivo 1 da CDEIC, e do PL 1464/2011, apensado.;;Pedro Henry;MT;PP;21/08/2012;;/proposicoesWeb/fichadetramitacao?idProposicao=553458
PRL 2 CSSF => PL 6717/2009;Parecer do Relator, Dep. Onofre Santo Agostini (PSD-SC), pela aprovação deste, e pela rejeição do PL 4461/2008, do PL 4467/2008, do PL 5752/2009, e do PL 3445/2008, apensados.;;Onofre Santo Agostini;SC;PSD;17/10/2012;;/proposicoesWeb/fichadetramitacao?idProposicao=557311
PRL 2 PL602505 => PL 6025/2005;Parecer pela: a) pela constitucionalidade, juridicidade, adequada técnica legislativa e, no mérito, pela rejeição das Emendas números 1, 9, 10, 11, 12, 13, 14, 15, 17, 18, 20, 21, 22, 24, 26, 27, 32, 33, 34, 35, 37, 39, 40, 41, 42, 44, 45, 46, 47, 48, 49, 50, 51, 52, 54, 55, 56, 57, 58, 59, 60, 61, 62, 63, 65, 66, 67, 68, 69, 72, 73, 74, 78, 79, 83, 84, 85, 88, 89, 90, 91, 95, 98, 102, 103, 104, 105, 107, 108, 110, 111, 112, 115, 117, 119, 120, 121, 122, 123, 124, 126, 128, 129, 131, 132, 133, 1 ...;;Sérgio Barradas Carneiro;BA;PT;11/10/2012;;/proposicoesWeb/fichadetramitacao?idProposicao=556938
SRL 15/2012 CCJC => REL 3/2012 CCJC => REL 1/2012 SUBCRIPE;"O art. 1º do Anteprojeto nº 1 passa a vigorar com a seguinte redação: Art. 1º Os arts. 121, 122, 129 e 136 do Decreto-Lei nº 2.848, de 7 de dezembro de 1940 - Código Penal passam a vigorar com a seguinte redação: ""Homicídio Simples Art.121 ............................................................................ Pena - reclusão, de oito a vinte anos. Forma Qualificada §1º Se o crime é cometido: I - mediante paga, mando, promessa de recompensa, por preconceito de raça, cor, etnia, deficiência, ...";;Marcos Rogério;RO;PDT;24/10/2012;;/proposicoesWeb/fichadetramitacao?idProposicao=557717
SBT 3 PL602505 => PL 6025/2005;"COMISSÃO ESPECIAL DESTINADA A PROFERIR PARECER AO PROJETO DE LEI N O 6.025, DE 2005, AO PROJETO DE LEI N O 8.046, DE 2010, AMBOS DO SENADO FEDERAL, E OUTROS, QUE TRATAM DO ?CÓDIGO DE PROCESSO CIVIL? (REVOGAM A LEI N O 5.869, DE 1973). PROJETOS DE LEI N os 6.025, DE 2005, E 8.046, DE 2010 (Em apenso os Projetos de Lei n.ºs 3.804, de 1993; 4.627, de 1994; 504 e 1.201, de 1995; 1.489, 1.823, 1.824 e 2.624, de 1996; 4.720, de 1998; 360, 484, 486, 487, 490, 491, 492, 493, 494, 496, ...";;Sérgio Barradas Carneiro;BA;PT;07/11/2012;;/proposicoesWeb/fichadetramitacao?idProposicao=559120
PRL 3 PL602505 => PL 6025/2005;Parecer do Relator-Geral, Dep. Sérgio Barradas Carneiro (PT-BA), pela constitucionalidade, juridicidade, adequada técnica legislativa e, no mérito, pela aprovação deste, dos de nºs 8.046/10, 1.824/96, 491/99, 4.386/04, 212, 361, 2.139 e 2.500/07, 3.387, 3.839 e 3.919/08, 5.748, 6.178 e 6.649/09, 1.628, 1.650, 1.956 e 2.627/11 e 3.743 e 4.110/12, apensados, das Emendas nºs 2 a 8, 16, 19, 23, 25, 28, 30, 36, 43, 53, 64, 70, 71, 75 a 77, 80 a 82, 86, 87, 92 a 94, 96, 97, 99 a 101, 106, 109, 113, 11 ...;;Sérgio Barradas Carneiro;;;07/11/2012;;/proposicoesWeb/fichadetramitacao?idProposicao=559124
PRL 2 CLP => SUG 6/2011 CLP;Parecer do Relator, Dep. Dr. Grilo (PSL-MG), pela aprovação.;;Dr. Grilo;MG;PSL;26/04/2011;;/proposicoesWeb/fichadetramitacao?idProposicao=499394
RDF 2 => PL 4208/2001;C Â M A R A D O S D E P U T A D O S REDAÇÃO FINAL PROJETO DE LEI Nº 4.208-F DE 2001 Altera dispositivos do Decreto-Lei nº 3.689, de 3 de outubro de 1941 ? Códi- go de Processo Penal, relativos à pri- são processual, fiança, liberdade pro- visória, demais medidas cautelares, e dá outras providências. O CONGRESSO NACIONAL decreta: Art. 1º Os arts. 282, 283, 289, 299, 300, 306, 310, 311, 312, 313, 314, 315, 317, 318, 319, 320, 321, 322, 323, 324, 325, 334, 335, 336, 337, 341, 343, 344, 345, 346, 35 ...;;João Campos;GO;PSDB;07/04/2011;;/proposicoesWeb/fichadetramitacao?idProposicao=498017
EMC 3/2013 CSSF => PL 6022/2013;"""Emenda ao PL 6.022/2013, que Altera a Lei nº 12.845, de 1º de agosto de 2013, que dispõe sobre o atendimento obrigatório e integral de pessoas em situação de violência sexual.""";;João Campos;GO;PSDB;01/10/2013;;/proposicoesWeb/fichadetramitacao?idProposicao=594239
EMC 1/2013 CSSF => PL 6022/2013;Altera a Lei nº 12.845, de 1º de agosto de 2013, que dispõe sobre o atendimento obrigatório e integral de pessoas em situação de violência sexual.;;Henrique Afonso;AC;PV;01/10/2013;;/proposicoesWeb/fichadetramitacao?idProposicao=594106
SBT 1 CSSF => PL 5666/2013;1 * 1 D B 9 D D B 8 3 5 * 1 D B 9 D D B 8 3 5 COMISSÃO DE SEGURIDADE SOCIAL E FAMÍLIA PROJETO DE LEI No 5.666, DE 2013 Dispõe sobre suplementação medicamentosa de ácido fólico, para prevenir má-formação fetal. Autor: Deputado ANDRÉ VARGAS Relator: Deputado DR. UBIALI I - RELATÓRIO O presente projeto de lei determina que o Sistema Único de Saúde (SUS) disponibilizará suplementação medicamentosa de ácido fólico para mulheres no período pré-concepcional, por ...;;Dr. Ubiali;SP;PSB;24/10/2013;;/proposicoesWeb/fichadetramitacao?idProposicao=598156
PRL 1 CSSF => PL 5666/2013;Parecer do Relator, Dep. Dr. Ubiali (PSB-SP), pela aprovação, com substitutivo.;;Dr. Ubiali;SP;PSB;24/10/2013;;/proposicoesWeb/fichadetramitacao?idProposicao=598152
SBT 2 CSSF => PL 1145/2011;COMISSÃO DE SEGURIDADE SOCIAL E FAMÍLIA PROJETO DE LEI No 1.145, DE 2011 Acrescenta art. 392-B à Consolidação das Leis do Trabalho para dispor sobre a licença maternidade das mulheres que trabalham em equipagens de embarcações da marinha mercante, de navegação fluvial e lacustre, de tráfego nos portos e de pesca. Autor: Deputado CARLOS BEZERRA Relator: Deputado ANTONIO BRITO I - RELATÓRIO O Projeto de Lei nº 1.145, de 2011, acrescenta art. 392-B à Consolidação das Leis do Trabalho ? ...;;Antonio Brito;BA;PTB;05/12/2013;;/proposicoesWeb/fichadetramitacao?idProposicao=603449
EMC 1/2012 CTASP => PL 371/2011;Prevê punição e mecanismo de fiscalização contra a desigualdade salarial entre homens e mulheres.;;Rogério Carvalho;SE;PT;14/03/2012;;/proposicoesWeb/fichadetramitacao?idProposicao=537451
PES 2 PL803510 => PL 8035/2010;"Parecer às emendas apresentadas ao Substitutivo do Relator , Dep. Angelo Vanhoni 1) pela inconstitucionalidade das emendas ao Substitutivo nºs 8, 225, 390, 411 e 418; e pela constitucionalidade, juridicidade e boa técnica legislativa das demais emendas apresentadas; 2) pela incompatibilidade com as normas orçamentárias e financeiras das emendas ao Substitutivo nºs 98, 107, 108, 225, 238, 390, 411, 418; não cabendo o exame de adequação orçamentária e financeira das demais emendas oferecidas ao Su ...";;Angelo Vanhoni;PR;PT;27/04/2012;;/proposicoesWeb/fichadetramitacao?idProposicao=543134
PRL 2 CFT => PL 478/2007;Parecer do relator, Dep. Eduardo Cunha, pela adequação financeira e orçamentária do Projeto de Lei nº 478/07 e dos PL's nºs 489/07, 1.763/07, 3.748/08 e 1.085/11, apensados, e do Substitutivo da Comissão de Seguridade Social e Família, com emenda.;;Eduardo Cunha;RJ;PMDB;24/05/2012;;/proposicoesWeb/fichadetramitacao?idProposicao=545774
SBT 3 PL803510 => PL 8035/2010;COMISSÃO ESPECIAL DESTINADA A PROFERIR PARECER AO PROJETO DE LEI N.º 8.035, de 2010 ? PLANO NACIONAL DE EDUCAÇÃO COMPLEMENTAÇÃO DE VOTO Após a análise das quatrocentas e quarenta e cinco emendas válidas ao Substitutivo 1, e apresentação do Substitutivo 2 foram oferecidos 155 destaques, que propiciaram o aprofundamento de temas e a construção de consensos. Mantivemos abertos os canais de diálogo com o Poder Executivo, os movimentos sociais e os nobres colegas parlamentares ...;;Angelo Vanhoni;PR;PT;29/05/2012;;/proposicoesWeb/fichadetramitacao?idProposicao=546099
SBT-A 1 PL803510 => PL 8035/2010;Substitutivo Adotado pela Comissão Especial.;;PL 8035/10 - PLANO NACIONAL DE EDUCAÇÃO;;;26/06/2012;;/proposicoesWeb/fichadetramitacao?idProposicao=551599
CVO 3 PL803510 => PL 8035/2010;"Parecer com Complementação de Voto, Dep. Angelo Vanhoni (PT-PR), pela constitucionalidade, juridicidade e técnica legislativa; pela adequação financeira e orçamentária; e, no mérito, pela aprovação deste, com substitutivo, pela constitucionalidade, juridicidade e técnica legislativa; pela não implicação da matéria com aumento ou diminuição da receita ou da despesa públicas, não cabendo pronunciamento quanto à adequação financeira e orçamentária; e, no mérito, pela aprovação da Emenda 885/2011 da ...";;Angelo Vanhoni;PR;PT;13/06/2012;;/proposicoesWeb/fichadetramitacao?idProposicao=548199
PRL 1 CCJC => PL 512/2011;Parecer do Relator, Dep. Alceu Moreira (PMDB-RS), pela constitucionalidade, juridicidade e técnica legislativa.;;Alceu Moreira;RS;PMDB;18/04/2013;;/proposicoesWeb/fichadetramitacao?idProposicao=572963
PRL 1 CSSF => PL 7787/2010;Parecer da Relatora, Dep. Cida Borghetti (PP-PR), pela aprovação.;;Cida Borghetti;PR;PP;03/04/2013;;/proposicoesWeb/fichadetramitacao?idProposicao=570254
VTS 3 CTASP => PL 120/2011;Acrescenta artigo à Consilidação das Leis do Trabalho, para dispor sobre a garantia no emprego durante e após as férias.;;Armando Vergílio;GO;PSD;09/04/2013;;/proposicoesWeb/fichadetramitacao?idProposicao=570910
VTS 1 CCJC => PL 4294/2008;Acrescenta parágrafo ao art. 1.632 da Lei nº 10.406, de 10 de janeiro de 2002 - Código Civil e ao art. 3º da Lei nº 10.741, de 1º de outubro de 2003 - Estatuto do Idoso, de modo a estabelecer a indenização por dano moral em razão do abandono afetivo;;Marcos Rogério;RO;PDT;17/04/2013;;/proposicoesWeb/fichadetramitacao?idProposicao=572581
PRL 2 CE => PL 3688/2000;Parecer da Relatora, pela aprovação do Substitutivo do Senado Federal ao PL nº 3.688/2000.;;Keiko Ota;SP;PSB;17/04/2013;;/proposicoesWeb/fichadetramitacao?idProposicao=572588
SBT 4 PL602505 => PL 6025/2005;"COMISSÃO ESPECIAL DESTINADA A PROFERIR PARECER AO PROJETO DE LEI NO 6.025, DE 2005, AO PROJETO DE LEI NO 8.046, DE 2010, AMBOS DO SENADO FEDERAL, E OUTROS, QUE TRATAM DO ?CÓDIGO DE PROCESSO CIVIL? (REVOGAM A LEI NO 5.869, DE 1973). PROJETOS DE LEI Nos 6.025, DE 2005, E 8.046, DE 2010 (Em apenso os Projetos de Lei n.ºs 3.804, de 1993; 4.627, de 1994; 504 e 1.201, de 1995; 1.489, 1.823, 1.824 e 2.624, de 1996; 4.720, de 1998; 360, 484, 486, 487, 490, 491, 492, 493, 494, 496, 507, 508, ...";;Paulo Teixeira;SP;PT;08/05/2013;;/proposicoesWeb/fichadetramitacao?idProposicao=576222
PRL 4 PL602505 => PL 6025/2005;Parecer do Relator, Dep. Paulo Teixeira (PT-SP) pela: a) constitucionalidade, juridicidade, adequada técnica legislativa e, no mérito, pela rejeição das Emendas números 1, 9, 10, 11, 12, 13,14, 15, 17, 18, 20, 21, 22, 24, 26, 27, 32, 33, 34, 37, 39, 40, 41, 42, 44, 45, 46, 47,48, 49, 50, 51, 52, 54, 55, 56, 57, 58, 59, 60, 61, 62, 63, 65, 66, 67, 68, 69, 72, 73,74, 75, 78, 79, 83, 84, 85, 88, 89, 90, 91, 95, 98, 102, 103, 104, 105, 107, 108,110, 111, 112, 115, 117, 119, 120, 121, 122, 123, 124,  ...;;Paulo Teixeira;SP;PT;08/05/2013;;/proposicoesWeb/fichadetramitacao?idProposicao=576243
PRL 3 CSSF => PL 4693/2009;Parecer da Relatora, Dep. Benedita da Silva (PT-RJ), pela rejeição.;;Benedita da Silva;RJ;PT;04/06/2013;;/proposicoesWeb/fichadetramitacao?idProposicao=579116
VTS 1 CFT => PL 478/2007;Dispõe sobre o Estatuto do Nascituro e dá outras providências.;;Afonso Florence;BA;PT;05/06/2013;;/proposicoesWeb/fichadetramitacao?idProposicao=579371
PRL 3 CSSF => PLP 161/2000;Parecer do Relator, Dep. Arnaldo Faria de Sá (PTB-SP), pela aprovação, com emendas.;;Arnaldo Faria de Sá;SP;PTB;26/06/2013;;/proposicoesWeb/fichadetramitacao?idProposicao=582173
EMS 4529/2004 => PL 4529/2004;"Substitutivo do Senado Federal ao Projeto de Lei da Câmara nº 98, de 2011 (nº 4.529, de 2004, na Casa de origem), que ""Institui o Estatuto da Juventude, dispondo sobre os direitos dos jovens, os princípios e diretrizes das políticas públicas de juventude, o estabelecimento do Sistema Nacional de Juventude e dá outras ...";São consideradas jovens as pessoas com idade entre 15 (quinze) e 29 (vinte e nove) anos.;Senado Federal;;;28/06/2013;;/proposicoesWeb/fichadetramitacao?idProposicao=582404
SBT 5 PL602505 => PL 6025/2005;"C Â M A R A D O S D E P U T A D O S COMISSÃO ESPECIAL DESTINADA A PROFERIR PARECER AO PROJETO DE LEI NO 6.025, DE 2005, AO PROJETO DE LEI NO 8.046, DE 2010, AMBOS DO SENADO FEDERAL, E OUTROS, QUE TRATAM DO ?CÓDIGO DE PROCESSO CIVIL? (REVOGAM A LEI NO 5.869, DE 1973). PROJETOS DE LEI NOS 6.025, DE 2005, E 8.046, DE 2010 (Em apenso os Projetos de Lei n.ºs 3.804, de 1993; 4.627, de 1994; 504 e 1.201, de 1995; 1.489, 1.823, 1.824 e 2.624, de 1996; 4.720, de 1998; 360, 484, 486, 487, ...";;Paulo Teixeira;SP;PT;02/07/2013;;/proposicoesWeb/fichadetramitacao?idProposicao=582547
EMC 1/2015 CDHM => PL 3369/2015;Institui o Estatuto das Famílias do Século XXI.;;Diego Garcia;PR;PHS;03/12/2015;;/proposicoesWeb/fichadetramitacao?idProposicao=2057987
PRL 4 CSSF => PL 5936/2009;Parecer do Relator, Dep. Paulo Rubem Santiago (PDT-PE), pela rejeição deste, do PL 989/2011, e do PL 5787/2013, apensados, e pela aprovação do PL 5665/2013, apensado.;;Paulo Rubem Santiago;PE;PDT;10/04/2014;;/proposicoesWeb/fichadetramitacao?idProposicao=612258
PRL 1 CTASP => PL 3783/2008;Parecer do Relator, Dep. Laercio Oliveira (SDD-SE), pela rejeição deste e do Substitutivo da Comissão de Seguridade Social e Família.;;Laercio Oliveira;SE;SDD;24/04/2014;;/proposicoesWeb/fichadetramitacao?idProposicao=613459
VTS 1 CCJC => MSC 59/2008;Submete à apreciação do Congresso Nacional o texto da Convenção nº 158, de 1982, da Organização Internacional do Trabalho - OIT, sobre Término da Relação de Trabalho por iniciativa do Empregador.;;"Arthur Oliveira Maia;Jutahy Junior";"BA;BA";"SD;PSDB";08/05/2014;;/proposicoesWeb/fichadetramitacao?idProposicao=614775
RDF 1 => PL 8035/2010;"C Â M A R A D O S D E P U T A D O S REDAÇÃO FINAL PROJETO DE LEI Nº 8.035-E DE 2010 Aprova o Plano Nacional de Educação - PNE e dá outras providências. O CONGRESSO NACIONAL decreta: Art. 1º É aprovado o Plano Nacional de Educação - PNE, com vigência por 10 (dez) anos, a contar da publicação desta Lei, na forma do Anexo, com vistas ao cumprimento do disposto no art. 214 da Constituição Federal. Art. 2º São diretrizes do PNE: I ? erradicação do analfabetismo; II ? universalização do atendimento es ...";;Angelo Vanhoni;PR;PT;03/06/2014;;/proposicoesWeb/fichadetramitacao?idProposicao=620279
PRL 3 CTASP => PL 1780/2007;Parecer do Relator, Dep. Roberto Balestra (PP-GO), pela rejeição deste e dos PLs 7217/10, 727/11, 2073/11, 3797/12, 3987/12, 4816/12, 5180/13, 5221/13, 7349/14 e 7647/14, apensados.;;Roberto Balestra;GO;PP;17/07/2014;;/proposicoesWeb/fichadetramitacao?idProposicao=620613
PRL 1 CFT => PL 3595/2012;Parecer do relator, Dep. Nelson Meurer, pela compatibilidade financeira e orçamentária.;;Nelson Meurer;PR;PP;15/07/2014;;/proposicoesWeb/fichadetramitacao?idProposicao=620075
SBT 5 CCJC => PL 7065/2006;Dispõe sobre a proteção aos trabalhadores ocupacionalmente expostos a radiações ionizantes.;;Sandra Rosado;RN;PSB;14/10/2014;;/proposicoesWeb/fichadetramitacao?idProposicao=623454
PRL 5 CCJC => PL 7065/2006;"Parecer da Relatora, Dep. Sandra Rosado (PSB-RN), pela constitucionalidade, juridicidade e técnica legislativa deste, com Substitutivo; da Emenda da Comissão de Minas e Energia; da Emenda da Comissão de Seguridade Social e Família; e do PL 4210/2012, apensado.";;Sandra Rosado;RN;PSB;14/10/2014;;/proposicoesWeb/fichadetramitacao?idProposicao=623427
PRL 1 CSSF => PDC 1460/2014;Parecer da Relatora, Dep. Benedita da Silva (PT-RJ), pela rejeição.;;Benedita da Silva;RJ;PT;13/11/2014;;/proposicoesWeb/fichadetramitacao?idProposicao=776163
PRL 1 CSSF => PDC 1359/2013;Parecer do Relator, Dep. Dr. Rosinha (PT-PR), pela rejeição.;;Dr. Rosinha;PR;PT;06/11/2014;;/proposicoesWeb/fichadetramitacao?idProposicao=737801
PRL 2 CSSF => PL 797/2011;Parecer da Relatora, Dep. Nilda Gondim (PMDB-PB), pela aprovação, com substitutivo.;;Nilda Gondim;PB;PMDB;24/11/2014;;/proposicoesWeb/fichadetramitacao?idProposicao=796300
SBT 1 CSSF => PL 797/2011;COMISSÃO DE SEGURIDADE SOCIAL E FAMÍLIA PROJETO DE LEI No 797, DE 2011 Inclui nos programas Sociais e Financeiros do Governo programa específico de apoio à mulher e a adolescente, nos casos de gravidez oriunda de estupro e nos casos de comprovada má formação do feto. Autora: Deputada LAURIETE Relatora: Deputada NILDA GONDIM I ? RELATÓRIO O Projeto de Lei nº 797, de 2011, busca incluir nos programas Sociais e Financeiros do Governo programa específico de apoio à mulher e a ...;;Nilda Gondim;PB;PMDB;24/11/2014;;/proposicoesWeb/fichadetramitacao?idProposicao=796305
SBT 1 PL699813 => PL 6998/2013;1 COMISSÃO ESPECIAL DESTINADA A PROFERIR PARECER AO PROJETO DE LEI Nº 6.998, DE 2013 ? Primeira Infância PROJETO DE LEI Nº 6.998, DE 2013 Altera o art. 1º e insere dispositivos sobre a Primeira Infância na Lei nº 8.069, de 1990, que dispõe sobre o Estatuto da Criança e do Adolescente e dá outras providências. Autor: Deputado Osmar Terra e outros Relator: Deputado João Ananias 1 ? RELATÓRIO Em 18 de dezembro de 2013, o Projeto de Lei em análise foi ...;;João Ananias;CE;PCdoB;17/11/2014;;/proposicoesWeb/fichadetramitacao?idProposicao=786552
PRL 2 PL699813 => PL 6998/2013;Parecer do Relator, Dep. João Ananias (PCdoB-CE), pela constitucionalidade, juridicidade e boa técnica legislativa e não implicação orçamentária e financeira deste, das emendas ao projeto de nºs 1 a 10, e, no mérito, pela aprovação do Projeto de Lei nº 6.998, de 2013, e das emendas nº 1, 3, 4, 5, 6, 7 e 9, com substitutivo, e pela rejeição das emendas nº 2, 8 e 10.;;João Ananias;CE;PCdoB;17/11/2014;;/proposicoesWeb/fichadetramitacao?idProposicao=786551
PRL 1 PL658313 => PL 6583/2013;"Parecer do Relator, Dep. Ronaldo Fonseca (PROS-DF), pela constitucionalidade, juridicidade e boa técnica legislativa dos PLs nºs 6.853/13 e 6.584/13, apensado, e da emenda apresentada na Comissão; e, no mérito, pela aprovação do PL nº 6.853/13 e da emenda apresentada, com substitutivo; e pela rejeição do PL 6.584/13.";;Ronaldo Fonseca;DF;PROS;17/11/2014;;/proposicoesWeb/fichadetramitacao?idProposicao=786555
SBT 1 PL658313 => PL 6583/2013;COMISSÃO ESPECIAL DESTINADA A PROFERIR PARECER AO PROJETO DE LEI Nº 6.583, DE 2013 Dispõe sobre o Estatuto da Família e dá outras providências. Autor: Deputado Anderson Ferreira Relator: Deputado Ronaldo Fonseca I - RELATÓRIO Trata-se de Projeto de Lei, de autoria do ilustre Deputado Anderson Ferreira, para instituir em nosso ordenamento jurídico o Estatuto da Família para dispor sobre os direitos da família e estabelecer diretrizes de políticas públicas para a valorização e ...;;Ronaldo Fonseca;DF;PROS;17/11/2014;;/proposicoesWeb/fichadetramitacao?idProposicao=786558
PRL 2 CSSF => PL 4082/2012;Parecer do Relator, Dep. Carlos Manato (SD-ES), pela aprovação.;;Carlos Manato;ES;SD;18/11/2014;;/proposicoesWeb/fichadetramitacao?idProposicao=786669
SBT-A 1 PL699813 => PL 6998/2013;Dispõe sobre as políticas públicas para a Primeira Infância, altera a Lei nº 8.069, de 1990, que dispõe sobre o Estatuto da Criança e do Adolescente, o Decreto-Lei nº 3.689, de 1941, a Consolidação das Leis do Trabalho - CLT, aprovada pelo Decreto-Lei nº 5.452, de 1943, a Lei nº 11.770, de 2008, e a Lei nº 12.662, de 2012.;;PL 6998/13 - PRIMEIRA INFANCIA;;;16/12/2014;;/proposicoesWeb/fichadetramitacao?idProposicao=858565
PRL 1 CE => PL 7721/2014;Parecer da Relatora, Dep. Maria do Rosário (PT-RS), pela rejeição.;;Maria do Rosário;RS;PT;19/12/2014;;/proposicoesWeb/fichadetramitacao?idProposicao=860875
ESB 9 PL699813 => SBT 1 PL699813 => PL 6998/2013;Emenda supressiva ao substitutivo do PL 6998/2013.;;Gorete Pereira;CE;PR;04/12/2014;;/proposicoesWeb/fichadetramitacao?idProposicao=818011
REL 1/2014 CPITRAB => RCP 11/2012;RELATÓRIO FINAL - Comissão Parlamentar de Inquérito destinada a apurar a exploração do trabalho infantil no Brasil e dá outras providências - CPITRAB;;Luciana Santos;PE;PCdoB;02/12/2014;Aguardando Providências Internas;/proposicoesWeb/fichadetramitacao?idProposicao=808878
ESB 5 PL699813 => SBT 1 PL699813 => PL 6998/2013;A redação prevista no § 2º do art. 8º da Lei nº 8.069, de 1990, com a redação dada pelo art. 19 do Substitutivo passa a vigorar com a seguinte redação:;;Darcísio Perondi;RS;PMDB;03/12/2014;;/proposicoesWeb/fichadetramitacao?idProposicao=817964
EMR 4 CCJC => PL 5936/2009;EMENDA SUPRESSIVA Suprima-se o § 2º do art. 1º do texto proposto e renumere-se o § 1º como parágrafo único.;;Moema Gramacho;BA;PT;17/06/2015;;/proposicoesWeb/fichadetramitacao?idProposicao=1307660
EMR 2 CCJC => PL 989/2011;"EMENDA SUBSTITUTIVA Substitua-se a expressão ""Art. 492-A"" por ""Art. 391-B"", no art. 1º do texto proposto.";;Moema Gramacho;BA;PT;17/06/2015;;/proposicoesWeb/fichadetramitacao?idProposicao=1307661
PRL 2 CCJC => PL 3783/2008;"Parecer da Relatora, Dep. Moema Gramacho (PT-BA), pela constitucionalidade, juridicidade e técnica legislativa deste, na forma do Substitutivo da Comissão de Seguridade Social e Família, com Subemendas, do PL 5936/2009, com emendas, do PL 1522/2015, com emenda, do PL 989/2011, com emenda, do PL 5659/2013, com emendas, do PL 5787/2013, e do PL 7136/2014, apensados; e pela injuridicidade do PL 5665/2013, apensado.";;Moema Gramacho;BA;PT;17/06/2015;;/proposicoesWeb/fichadetramitacao?idProposicao=1307593
PRL 3 CCJC => PL 3783/2008;Parecer da Relatora, Dep. Moema Gramacho (PT-BA), pela constitucionalidade, juridicidade e técnica legislativa deste, com emendas, do Substitutivo da Comissão de Seguridade Social e Família, com subemenda, do PL 5936/2009, com emendas, do PL 1522/2015, com emenda, do PL 989/2011, com emenda, do PL 5659/2013, com emendas, do PL 5787/2013, e do PL 7136/2014, apensados, e pela injuridicidade do PL 5665/2013, apensado.;;Moema Gramacho;BA;PT;30/06/2015;;/proposicoesWeb/fichadetramitacao?idProposicao=1537506
EMR 5 CCJC => PL 5936/2009;"EMENDA SUBSTITUTIVA Substitua-se a expressão ""Art. 392-C"" por ""Art. 391-B"", no art. 1º do texto proposto.";;Moema Gramacho;BA;PT;30/06/2015;;/proposicoesWeb/fichadetramitacao?idProposicao=1537520
EMR 2 CCJC => PL 3783/2008;"EMENDA SUBSTITUTIVA N° Dê-se ao art. 1º do projeto a seguinte redação: ""Art. 1º O art. 391-A da Consolidação das Leis do Trabalho - CLT, aprovada pelo Decreto-lei n.º 5.452, de 1º de maio de 1943, passa a vigorar acrescido do seguinte parágrafo: Art. 391-A. ....................................................... Parágrafo único. O aborto ou o falecimento do filho não interrompe a estabilidade provisória assegurada à mulher desde a gravidez até cinco meses após o parto. (NR).""";;Moema Gramacho;BA;PT;30/06/2015;;/proposicoesWeb/fichadetramitacao?idProposicao=1537519
PRL 3 CSSF => PL 254/2011;Parecer do Relator, Dep. Marx Beltrão (PMDB-AL), pela aprovação deste, e do PL 3979/2012, apensado, sugerindo a declaração de prejudicialidade do apensado, por se tratar de texto idêntico.;;Marx Beltrão;AL;PMDB;02/06/2015;;/proposicoesWeb/fichadetramitacao?idProposicao=1301799
SBT 3 CTASP => PL 6239/2013;Altera o § 2º do art. 134 da Consolidação das Leis do Trabalho (CLT), aprovada pelo Decreto-Lei nº 5.452, de 1º de maio de 1943, para retirar a obrigatoriedade de concessão de férias de uma só vez aos menores de 18 (dezoito) anos e aos maiores de 50 (cinquenta) anos, e para permitir a concessão do gozo de férias proporcionais aos empregados contratados há, pelo menos, 6 (seis) meses.;;Augusto Coutinho;PE;SD;18/08/2015;;/proposicoesWeb/fichadetramitacao?idProposicao=1671710
PRL 3 CTASP => PL 6239/2013;Parecer do Relator, Dep. Augusto Coutinho (SD-PE), pela aprovação dos PLs nºs 5.294/13, 7.441/14, 880/15 e da Emenda nº 1/13, na forma do Substitutivo anexo, e pela, rejeição dos PLs nºs 6.239/13 e 1.093/15.;;Augusto Coutinho;PE;SD;18/08/2015;;/proposicoesWeb/fichadetramitacao?idProposicao=1671663
EMR 1 CE => PL 7633/2014;Dispõe sobre a humanização da assistência à mulher e ao neonato durante o ciclo gravídico-puerperal e dá outras providências.;;Keiko Ota;SP;PSB;05/08/2015;;/proposicoesWeb/fichadetramitacao?idProposicao=1598401
SBT 3 PL658313 => PL 6583/2013;COMISSÃO ESPECIAL DESTINADA A PROFERIR PARECER AO PROJETO DE LEI Nº 6.583, DE 2013 PROJETO DE LEI Nº 6.583, DE 2013 (Apenso o PL nº 6.584/13) Dispõe sobre o Estatuto da Família e dá outras providências. Autor: Deputado ANDERSON FERREIRA Relator: Deputado DIEGO GARCIA I ? RELATÓRIO Trata-se de Projeto de Lei, de autoria do ilustre Deputado Anderson Ferreira, que pretende instituir em nosso ordenamento jurídico o Estatuto da Família, para dispor sobre os direitos da família e ...;;Diego Garcia;PR;PHS;23/09/2015;;/proposicoesWeb/fichadetramitacao?idProposicao=1756977
VTS 2 CCJC => PL 5069/2013;"""Acrescenta o art. 127-A ao Decreto-Lei nº 2.848, de 7 de dezembro de 1940 - Código Penal.""";;"Chico Alencar;Ivan Valente";"RJ;SP";"PSOL;PSOL";22/09/2015;;/proposicoesWeb/fichadetramitacao?idProposicao=1734894
