Câmara dos Deputados;;;;;;;;
"Relatório de Proposições
Resultado da Pesquisa";;;;;;;;
Proposições;Ementa;Explicação ;Autor;UF;Partido;Apresentaç;Situação;Link 
PL 3391/2019;Altera a Lei n. 8.080, de 19 de setembro de 1990, que dispõe sobre as condições para a promoção, proteção e recuperação da saúde, para dispor sobre a prioridade na assistência psicológica às mulheres que sofreram aborto espontâneo, nos casos permitidos em Lei ou na ocorrência de óbito perinatal;;Fábio Faria;RN;PSD;06/06/2019;Aguardando Parecer;/proposicoesWeb/fichadetramitacao?idProposicao=2207082
PL 3553/2020;Institui diretrizes para serviços de proteção e atendimento especializado a gestantes dependentes químicas a serem criados no âmbito da Proteção Especial da Assistência Social, e dá outras providências .;;Marreca Filho;MA;PATRIOTA;30/06/2020;Aguardando Despacho do Presidente da Câmara dos Deputados;/proposicoesWeb/fichadetramitacao?idProposicao=2256414
PL 291/2020;"""Dispõe sobre a instituição do Programa de Orientação Psicológica e Social - Boa Mãe, no âmbito federal e dá outras providências"".";;"Aline Gurgel;Daniela do Waguinho;Leandre;Manuel Marcos";"AP;RJ;PR;AC";"REPUBLIC;MDB;PV;REPUBLIC";12/02/2020;Aguardando Designação de Relator;/proposicoesWeb/fichadetramitacao?idProposicao=2237085
PL 3775/2019;Altera o art. 394-A da Lei 13.467/2017, da Consolidação das Leis do Trabalho - CLT, aprovada pelo Decreto-lei nº 5.452, de 1º de maio de 1943, para assegurar os direitos da grávida e da lactante em atividades laborais salubres.;;Júnior Bozzella;SP;PSL;27/06/2019;Tramitando em Conjunto;/proposicoesWeb/fichadetramitacao?idProposicao=2209800
PL 5474/2019;Dispõe sobre a oferta de absorventes higiênicos em unidades da rede de atenção primária à saúde.;;Marília Arraes;PE;PT;09/10/2019;Tramitando em Conjunto;/proposicoesWeb/fichadetramitacao?idProposicao=2224730
PL 3032/2020;"""Dispõe sobre política de proteção às mulheres em situação de vulnerabilidade; pela Rede Pública de Saúde com a utilização do Contraceptivo Reversível de Longa Duração de Etonogestrel, e dá outras providências"".";;Alexandre Frota;SP;PSDB;01/06/2020;Aguardando Autorização do Despacho;/proposicoesWeb/fichadetramitacao?idProposicao=2254199
PL 853/2019;"Acrescenta ao calendário oficial a ""Semana Nacional de Conscientização sobre Direitos das Gestantes"", a ser celebrada anualmente em 15 de agosto, e dá outras providências.";;Sâmia Bomfim;SP;PSOL;19/02/2019;Pronta para Pauta;/proposicoesWeb/fichadetramitacao?idProposicao=2192288
PL 3050/2011;Altera o §2º do art. 10 da Lei 9.263, de 12 de janeiro de 1996, que trata do planejamento familiar, de forma a permitir a realização da laqueadura tubárea nos períodos de parto ou aborto em caso de cesária anterior.;;Aguinaldo Ribeiro;PB;PP;21/12/2011;Tramitando em Conjunto;/proposicoesWeb/fichadetramitacao?idProposicao=533044
PL 5431/2013;Acrescenta artigo à consolidação das Leis do Trabalho - CLT, tornando obrigatória a instauração de inquérito para apuração de falta grave de empregada estável nos termos do art. 10 Inciso II, alínea a do Ato das Disposições Constitucionais Transitórias.;Altera o Decreto-lei nº 5.452, de 1943.;Vicentinho;SP;PT;23/04/2013;Tramitando em Conjunto;/proposicoesWeb/fichadetramitacao?idProposicao=573660
PL 5659/2013;Acrescenta artigo ao Decreto Lei nº 5.452 de 1º de maio de 1943-CLT, para dispor sobre a estabilidade provisória da gestante.;;Celso Jacob;RJ;PMDB;28/05/2013;Tramitando em Conjunto;/proposicoesWeb/fichadetramitacao?idProposicao=578655
PL 5665/2013;Acrescenta parágrafo único ao art. 391-A da Consolidação das Leis do Trabalho - CLT, aprovada pelo Decreto-lei nº 5.452, de 1º de maio de 1943, para dispor sobre a estabilidade provisória da adotante.;;"Dr. Jorge Silva;Norma Ayub";"ES;ES";"PDT;DEM";28/05/2013;Tramitando em Conjunto;/proposicoesWeb/fichadetramitacao?idProposicao=578754
PL 5908/2013;Modifica a Lei nº 8.069, de 13 de julho de 1990, para estabelecer o procedimento destinado à inscrição de crianças e adolescentes nos cadastros estaduais e nacional de adoção.;;Carlos Bezerra;MT;PMDB;09/07/2013;"Tramitando em Conjunto;Tramitando em Conjunto";/proposicoesWeb/fichadetramitacao?idProposicao=584184
PL 166/2011;Dispõe sobre a criação de Casas Apoio destinadas ao atendimento de adolescentes grávidas.;;"Weliton Prado;Ricardo Izar";"MG;SP";"PT;PP";07/02/2011;Aguardando Designação de Relator;/proposicoesWeb/fichadetramitacao?idProposicao=491186
PL 1145/2011;Acrescenta o art. 392-B à Consolidação das Leis do Trabalho, para dispor sobre a licença maternidade das mulheres que trabalham em equipagens das embarcações de marinha mercante, de navegação fluvial e lacustre, de tráfego nos portos e de pesca.;Altera o Decreto-lei nº 5.452, de 1943.;Carlos Bezerra;MT;PMDB;26/04/2011;Aguardando Parecer;/proposicoesWeb/fichadetramitacao?idProposicao=499401
PL 1545/2011;Inclui art. 128-A no Decreto-Lei nº 2.848, de 07 de dezembro de 1940.;Tipifica o crime de aborto praticado por médico quando não for os tipos admitidos no Código Penal: necessário ou quando a gravidez resultante de estupro (sentimental).;Eduardo Cunha;RJ;PMDB;08/06/2011;Aguardando Parecer;/proposicoesWeb/fichadetramitacao?idProposicao=507573
PL 8363/2017;Dispõe sobre o exercício profissional da atividade de Doula e dá outras providências.;;Erika Kokay;DF;PT;23/08/2017;Aguardando Designação de Relator;/proposicoesWeb/fichadetramitacao?idProposicao=2148936
PL 5745/2016;Obriga a criação do Programa Nacional de Prevenção à Gravidez Precoce.;;Felipe Bornier;RJ;PROS;05/07/2016;Tramitando em Conjunto;/proposicoesWeb/fichadetramitacao?idProposicao=2090372
PL 7109/2010;Assegura à estudante grávida o regime de exercícios domiciliares instituído pelo Decreto-Lei nº 1.044, de 21 de outubro de 1969, e altera a Lei nº 11.788, de 25 de setembro de 2008, que dispõe sobre o estágio de estudantes, para possibilitar a interrupção do estágio da estudante ...;Revoga a Lei nº 6.202, de 1975.;Senado Federal - Expedito Júnior;RO;PR;09/04/2010;Aguardando Designação de Relator;/proposicoesWeb/fichadetramitacao?idProposicao=472902
PL 7306/2010;Acresce os § 1º-A ao art. 50 da Lei nº 6.015, 31 de dezembro de 1973.;Permite aos pais a escolha do lugar onde se dará o registro do recém-nascido.;Mário Heringer;MG;PDT;12/05/2010;Tramitando em Conjunto;/proposicoesWeb/fichadetramitacao?idProposicao=476656
PL 4126/2015;Normatiza o direito ao parto humanizado na rede pública de saúde e dá outras providências.;;Felipe Bornier;RJ;PSD;16/12/2015;Tramitando em Conjunto;/proposicoesWeb/fichadetramitacao?idProposicao=2075709
PL 4640/2016;Altera a Lei 8.069 de 13 de Julho de 1990, para assegurar à mulher o direito à escolha da família substituta na hipótese de entrega consciente para adoção e cria Campanha Nacional de conscientização sobre a entrega voluntária de bebes para adoção.;;Flavinho;SP;PSB;08/03/2016;"Tramitando em Conjunto;Tramitando em Conjunto";/proposicoesWeb/fichadetramitacao?idProposicao=2078892
RIC 42/2020;Requer à Ministra de Estado da Mulher, da Família e dos Direitos Humanos, informações sobre os gastos com a campanha pela abstinência sexual.;;Alexandre Padilha;SP;PT;05/02/2020;"Aguardando Remessa ao Arquivo;Aguardando Deliberação";/proposicoesWeb/fichadetramitacao?idProposicao=2236628
RIC 32/2020;Requer informações ao Senhor Ministro de Estado da Saúde relacionadas à Lei 13.798/2019.;;Diego Garcia;PR;PODE;05/02/2020;"Aguardando Remessa ao Arquivo;Aguardando Deliberação";/proposicoesWeb/fichadetramitacao?idProposicao=2236578
RIC 113/2020;"Solicita à Ministra de Estado da Mulher, da Família e dos Direitos Humanos esclarecimentos acerca da campanha ""Adolescência primeiro, gravidez depois - tudo tem o seu tempo"".";;Sâmia Bomfim;SP;PSOL;17/02/2020;"Aguardando Remessa ao Arquivo;Aguardando Deliberação";/proposicoesWeb/fichadetramitacao?idProposicao=2237605
RIC 227/2020;Requer informações a Excelentíssima Senhora Ministra de Estado da Mulher, da Família e dos Direitos Humanos, Damares Alves, acerca dos dados relativos a ocorrência de gravidez precoce em nossa sociedade.;;COMISSÃO EXTERNA DE POLÍTICAS PARA A PRIMEIRA INFÂNCIA;;;12/03/2020;"Aguardando Remessa ao Arquivo;Aguardando Deliberação";/proposicoesWeb/fichadetramitacao?idProposicao=2239013
RIC 117/2020;Requer informações da Ministra da Mulher, da Família e dos Direitos Humanos, Damares Alves, sobre a situação do programa Casa da Mulher Brasileira, de responsabilidade dessa pasta.;;Marília Arraes;PE;PT;18/02/2020;"Aguardando Remessa ao Arquivo;Aguardando Deliberação";/proposicoesWeb/fichadetramitacao?idProposicao=2237695
PL 4024/2015;Introduz o parágrafo quarto no art. 6º da Lei nº 8.742, de 7 de dezembro de 1993 (Lei Orgânica da Assistência Social), para instituir programas de prevenção à gravidez precoce.;;Marcelo Belinati;PR;PP;15/12/2015;Tramitando em Conjunto;/proposicoesWeb/fichadetramitacao?idProposicao=2075021
PL 1693/2015;Altera a Consolidação das Leis do Trabalho - CLT, aprovada pelo Decreto-Lei nº 5.452, de 1º de maio de 1943, e a Lei nº 8.213, de 24 de julho de 1991, para dispor sobre a extensão da licença-maternidade e do salário-maternidade em caso de nascimento prematuro ou quando a criança precisa de internação hospitalar sem o acompanhamento da mãe ou responsável.;;Aureo;RJ;SD;26/05/2015;"Tramitando em Conjunto;Tramitando em Conjunto;Tramitando em Conjunto";/proposicoesWeb/fichadetramitacao?idProposicao=1296505
PL 2040/2015;Acrescenta parágrafo único ao art. 391-A da Consolidação das Leis do Trabalho (CLT) para estabelecer que só serão consideradas para efeito de rescisão do contrato de trabalho por justa causa da empregada gestante as faltas graves cometidas ou que vierem ao conhecimento do empregador durante a gravidez.;;Carlos Bezerra;MT;PMDB;22/06/2015;Tramitando em Conjunto;/proposicoesWeb/fichadetramitacao?idProposicao=1514401
PL 2893/2019;Revoga o art. 128 do Decreto-Lei nº 2.848, de 7 de dezembro de 1940 (Código Penal).;Revoga dispositivo que trata do aborto necessário e do aborto em caso de estupro.;"Chris Tonietto;Filipe Barros";"RJ;PR";"PSL;PSL";15/05/2019;Aguardando Pendências;/proposicoesWeb/fichadetramitacao?idProposicao=2203415
PL 7633/2014;Dispõe sobre a humanização da assistência à mulher e ao neonato durante o ciclo gravídico-puerperal e dá outras providências.;;Jean Wyllys;RJ;PSOL;29/05/2014;Tramitando em Conjunto;/proposicoesWeb/fichadetramitacao?idProposicao=617546
PEC 196/2016;Dá nova redação ao inciso XVIII do art. 7º da Constituição Federal, para dispor sobre a licença-maternidade.;Estabelece que tanto a mãe biológica quanto a mãe adotiva de múltiplos tem o direito de ampliar em 30 (trinta) dias a licença maternidade para cada filho nascido vivo ou adotado além do primeiro.;Efraim Filho;PB;DEM;22/03/2016;"Tramitando em Conjunto;Tramitando em Conjunto";/proposicoesWeb/fichadetramitacao?idProposicao=2080196
PEC 151/2019;"Altera o art. 10, II, ""b"" do Ato das Disposições Constitucionais Transitórias, para ampliar a regra de estabilidade nele contida.";;Ruy Carneiro;PB;PSDB;25/09/2019;;/proposicoesWeb/fichadetramitacao?idProposicao=2222051
AA 1 MESA => PL 5452/2016;Substitutivo da Câmara dos Deputados ao Projeto de Lei nº 5.452-B de 2016 do Senado Federal (PLS Nº 618/2015 na Casa de origem), que ?acrescenta os arts. 218-C e 225-A ao Decreto- Lei nº 2.848, de 7 de dezembro de 1940 (Código Penal), para tipificar o crime de divulgação de cena de estupro e prever causa de aumento de pena para o crime de estupro cometido por duas ou mais pessoas?. Dê-se ao projeto a seguinte redação: Tipifica os crimes ...;;Rodrigo Maia;RJ;DEM;12/03/2018;;/proposicoesWeb/fichadetramitacao?idProposicao=2169099
AA 1 MESA => PL 2350/2015;Altera a Lei nº 6.202, de 17 de abril de 1975, que atribui à estudante em estado de gestação o regime de exercícios domiciliares instituído pelo Decreto-Lei nº 1.044, de 21 de outubro de 1969, e a Lei nº 9.394, de 20 de dezembro de 1996, que estabelece as diretrizes e bases da educação nacional, para assegurar os direitos educacionais às mulheres gestantes, em estado de puerpério e lactantes. O CONGRESSO NACIONAL decreta: Art. 1º O arts. 1º e 2º da Lei nº 6.202, de 17 de ...;;Rodrigo Maia;RJ;DEM;12/03/2018;;/proposicoesWeb/fichadetramitacao?idProposicao=2169103
PL 3558/2020;Altera a base de cálculo da Contribuição para o Financiamento da Seguridade Social - Cofins devida pelos fabricantes de cigarros.;Altera a Lei nº 11.196, de 2005.;Dra. Soraya Manato;ES;PSL;30/06/2020;Aguardando Despacho do Presidente da Câmara dos Deputados;/proposicoesWeb/fichadetramitacao?idProposicao=2256420
PL 4811/2016;"Dispõe sobre adoção. Altera as Leis n.ºs 8.069, de 13 de julho de 1990 e 12.010 de 3 de agosto de 2009 a fim de possibilitar a habilitação sumária de famílias substitutas em localidades desprovidas de abrigos de institucionalização ou de programas de acolhimento familiar, sem prejuízo dos Cadastros Estaduais e Nacional de adoção; e dá outras providências.";;Rafael Motta;RN;PSB;23/03/2016;"Tramitando em Conjunto;Tramitando em Conjunto";/proposicoesWeb/fichadetramitacao?idProposicao=2080287
PL 1945/2020;Altera dispositivo do Decreto-Lei nº 2.848, de 7 de dezembro de 1940 (Código Penal), para fins de inclusão de causa de aumento de pena em caso de aborto realizado em razão de microcefalia ou qualquer outra anomalia ou malformação do feto.;;Chris Tonietto;RJ;PSL;16/04/2020;Aguardando Autorização do Despacho;/proposicoesWeb/fichadetramitacao?idProposicao=2249319
INC 1326/2019;Sugere a criação do Comitê Gestor da Primeira Infância no âmbito do Poder Executivo Federal.;;Paula Belmonte;DF;CIDADANIA;18/09/2019;Aguardando Remessa ao Arquivo;/proposicoesWeb/fichadetramitacao?idProposicao=2220931
REQ 1469/2020;Requer o comparecimento do Sr. Eduardo Pazuello, Ministro interino da Saúde, para prestar esclarecimentos acerca dos motivos da exoneração do corpo técnico da Coordenação de Saúde das Mulheres, da Coordenação-Geral de Ciclos da Vida e da revogação da nota técnica 16/2020 .COSMU/CGCIVI/DAPES/SAPS/MS, que visava garantir o acesso à saúde sexual e saúde reprodutiva em tempos da pandemia da COVID-19.;;"Fernanda Melchionna ;Edmilson Rodrigues ;Sâmia Bomfim ;David Miranda ;Áurea Carolina ;Ivan Valente ;Marcelo Freixo ;Luiza Erundina ;Glauber Braga";"RS;PA;SP;RJ;MG;SP;RJ;SP;RJ";"PSOL;PSOL;PSOL;PSOL;PSOL;PSOL;PSOL;PSOL;PSOL";08/06/2020;Aguardando Despacho do Presidente da Câmara dos Deputados;/proposicoesWeb/fichadetramitacao?idProposicao=2254773
INC 774/2019;Sugere o aperfeiçoamento de ações de atenção a mulheres portadoras de endometriose.;;Maria Rosas;SP;PRB;29/05/2019;Aguardando Remessa ao Arquivo;/proposicoesWeb/fichadetramitacao?idProposicao=2205404
PL 260/2019;Dispõe sobre a proibição do aborto.;;Márcio Labre;RJ;PSL;04/02/2019;Tramitando em Conjunto;/proposicoesWeb/fichadetramitacao?idProposicao=2190788
PL 1085/2011;Dispõe sobre a assistência para a mulher vítima de estupro que vier a optar por realizar aborto legal.;Concede bolsa-auxílio à mulher que engravidar em decorrência de estupro e optar por realizar aborto legal ou que sofrer aborto espontâneo.;Cleber Verde;MA;PRB;14/04/2011;Tramitando em Conjunto;/proposicoesWeb/fichadetramitacao?idProposicao=498623
PL 5893/2016;Altera a Consolidação das Leis do Trabalho (CLT), aprovada pelo Decreto-Lei nº 5.452, de 1º de maio de 1943, e a Lei nº 8.112, de 11 de dezembro de 1990, para dispor sobre o direito de falta, sem prejuízo do salário, nos casos de nascimento de neto.;;Renata Abreu;SP;PTN;02/08/2016;"Tramitando em Conjunto;Tramitando em Conjunto;Tramitando em Conjunto";/proposicoesWeb/fichadetramitacao?idProposicao=2092652
PL 7122/2017;Dispõe sobre a concessão de licença e de salário-maternidade nos casos de aborto não criminoso e de nascimento de bebê natimorto.;Altera o Decreto-Lei nº 5.452, de 1943 e a Lei nº 8.213, de 1991.;Luciano Ducci;PR;PSB;15/03/2017;"Tramitando em Conjunto;Tramitando em Conjunto;Tramitando em Conjunto";/proposicoesWeb/fichadetramitacao?idProposicao=2125614
PL 9696/2018;Altera a Lei nº 8.213, de 24 de julho de 1991 e o Decreto-Lei nº 5.452, de 1º de maio de 1943 para dispor sobre a licença maternidade em caso de natimorto ou de aborto não criminoso.;;José Guimarães;CE;PT;06/03/2018;"Tramitando em Conjunto;Tramitando em Conjunto;Tramitando em Conjunto";/proposicoesWeb/fichadetramitacao?idProposicao=2168783
PL 2534/2015;Altera o inciso III do art. 473 da Consolidação das Leis do Trabalho (CLT), para dispor sobre a licença-paternidade de quinze dias.;Altera o Decreto-lei nº 5.452, de 1943.;Veneziano Vital do Rêgo;PB;PMDB;05/08/2015;"Tramitando em Conjunto;Tramitando em Conjunto;Tramitando em Conjunto";/proposicoesWeb/fichadetramitacao?idProposicao=1598464
PL 6309/2019;"Institui o Estatuto das Famílias e a definição de entidade familiar; políticas públicas para as famílias; diretrizes para a educação dos filhos; e altera a Lei nº 7.713, de 22 de dezembro de 1988, para incluir hipótese de isenção de imposto de renda para famílias numerosas.";;Pastor Eurico;PE;PATRIOTA;04/12/2019;Aguardando Apensação;/proposicoesWeb/fichadetramitacao?idProposicao=2232231
SBT 1 CSSF => PL 1599/2020 (Nº Anterior: PL 6429/2016);Institui a Semana Nacional de Prevenção e Combate à Microcefalia.;;Diego Garcia;PR;PHS;31/08/2017;;/proposicoesWeb/fichadetramitacao?idProposicao=2150072
PRL 1 CSSF => PL 1599/2020 (Nº Anterior: PL 6429/2016);Parecer do Relator, Dep. Diego Garcia (PHS-PR), pela aprovação deste, e do PL 7429/2017, apensado, com substitutivo.;;Diego Garcia;PR;PHS;31/08/2017;;/proposicoesWeb/fichadetramitacao?idProposicao=2149994
PL 6232/2019;Acrescenta o inciso VI ao parágrafo único do art. 3º da Lei nº 9.263, de 12 de janeiro de 1996, para reconhecer o direito de gestantes e mulheres em idade fértil à realização, nos serviços de saúde do SUS, do exame para detecção da trombofilia.;;Mariana Carvalho;RO;PSDB;27/11/2019;Tramitando em Conjunto;/proposicoesWeb/fichadetramitacao?idProposicao=2231073
PRL 1 MESA => RIC 227/2020;Parecer do Relator, Dep. Marcos Pereira (REPUBLIC-SP), pela aprovação.;;Marcos Pereira;SP;REPUBLIC;18/03/2020;;/proposicoesWeb/fichadetramitacao?idProposicao=2239553
REQ 29/2020 CEXINFAN;"Requer a realização de Audiência Pública no âmbito desta comissão para debater o tema ""gravidez precoce e planejamento familiar"".";;Paula Belmonte;DF;CIDADANIA;03/03/2020;Aguardando Providências Internas;/proposicoesWeb/fichadetramitacao?idProposicao=2238284
REQ 16/2020 CEXINFAN;Requer informações ao Excelentíssimo Senhor Ministro da Saúde, Senhor Luiz Henrique Mandetta, acerca de dados sobre gravidez precoce.;;Paula Belmonte;DF;CIDADANIA;03/03/2020;Aguardando Providências Internas;/proposicoesWeb/fichadetramitacao?idProposicao=2238270
REQ 17/2020 CEXINFAN;Requer informações ao Excelentíssimo a Senhora Ministra da Mulher, da Família e dos Direitos Humanos, Senhora Damares Alves, acerca de dados sobre gravidez precoce.;;Paula Belmonte;DF;CIDADANIA;03/03/2020;Aguardando Providências Internas;/proposicoesWeb/fichadetramitacao?idProposicao=2238271
REQ 18/2020 CEXINFAN;Requer informações ao Excelentíssimo Senhor Sérgio Fernando Moro, Ministro da Justiça e da Segurança Pública, acerca do encarceramento das mães no Brasil.;;Paula Belmonte;DF;CIDADANIA;03/03/2020;Aguardando Providências Internas;/proposicoesWeb/fichadetramitacao?idProposicao=2238272
PL 6583/2013;Dispõe sobre o Estatuto da Família e dá outras providências.;;Anderson Ferreira;PE;PR;16/10/2013;"Aguardando Deliberação de Recurso;Comissão em funcionamento";/proposicoesWeb/fichadetramitacao?idProposicao=597005
PL 3206/2019;"Dispõe sobre o Programa ""Mãezinha Brasileira"".";Altera a Lei nº 8.069, de 1990.;Flávia Arruda;DF;PL;29/05/2019;Tramitando em Conjunto;/proposicoesWeb/fichadetramitacao?idProposicao=2205433
PL 4729/2016;"Altera a Lei nº 9.656 de 3 de junho de 1998, que ""dispõe sobre os planos e seguros privados de assistência à saúde"".";Extingue a carência para cobertura de parto por plano de saúde para gravidez de risco.;Carlos Henrique Gaguim;TO;PTN;15/03/2016;"Tramitando em Conjunto;Tramitando em Conjunto;Tramitando em Conjunto";/proposicoesWeb/fichadetramitacao?idProposicao=2079526
PL 5126/2016;Altera as Leis 8.069, de 13 de julho de 1990 e 9.656, de 3 de junho de 1998.;Trata do direito de acesso aos métodos de diagnóstico e ao tratamento integral no âmbito do Sistema Único de Saúde, e à sorologia nos planos de seguros privados de saúde.;Geraldo Resende;MS;PSDB;02/05/2016;"Tramitando em Conjunto;Tramitando em Conjunto;Tramitando em Conjunto";/proposicoesWeb/fichadetramitacao?idProposicao=2082834
PL 254/2020;Acrescenta dispositivo à LDB para o atendimento educacional diferenciado à gestante ou lactante.;Altera a Lei nº 9.394, de 1996.;Rubens Otoni;GO;PT;11/02/2020;Aguardando Designação de Relator;/proposicoesWeb/fichadetramitacao?idProposicao=2236970
PRL 5 CSSF => PL 8363/2017;Parecer da Relatora, Dep. Benedita da Silva (PT-RJ), pela aprovação do PL 8363/2017 e pela aprovação parcial da Emenda nº 4 ao Substitutivo na forma do Substitutivo e pela rejeição das Emendas nº 01, 02, 03 e 05 ao Substitutivo.;;Benedita da Silva;RJ;PT;30/10/2019;;/proposicoesWeb/fichadetramitacao?idProposicao=2227530
PRL 1 MESA => RIC 113/2020;Parecer do Relator, Dep. Marcos Pereira (REPUBLIC-SP), pela aprovação.;;Marcos Pereira;SP;REPUBLIC;27/02/2020;;/proposicoesWeb/fichadetramitacao?idProposicao=2238030
PL 4958/2019;Dispõe alteração do artigo 306 da Lei nº 9.503, de 23 de setembro de 1997, que institui o Código de Trânsito Brasileiro, objetivando o uso do drogômetro e dá outras providências.;;Magda Mofatto;GO;PL;11/09/2019;Tramitando em Conjunto;/proposicoesWeb/fichadetramitacao?idProposicao=2219647
REQ 248/2020;Requer a criação de Comissão Especial para estudo das razões do aumento de denúncias de violência obstétrica e a alta taxa de morte materna no Brasil.;;Soraya Santos;RJ;PL;17/02/2020;;/proposicoesWeb/fichadetramitacao?idProposicao=2237674
PL 10204/2018;Estabelece normas gerais para a realização de concursos públicos no âmbito da Administração Pública direta e indireta da União.;;Carlos Henrique Gaguim;TO;DEM;09/05/2018;Tramitando em Conjunto;/proposicoesWeb/fichadetramitacao?idProposicao=2174562
PL 10757/2018;"Concede pensão especial às pessoas com microcefalia, por infecção causada pelo vírus Zika, entre os anos de 2014 e 2017, e revoga o caput e o § 2º do art. 18 da Lei nº 13.301, de 27 de junho de 2016, que ""Dispõe sobre a adoção de medidas de vigilância em saúde quando verificada situação de iminente perigo à saúde pública pela presença do mosquito transmissor do vírus da dengue, do vírus chikungunya e do vírus da zika; e altera a Lei nº 6.437, de 20 de agosto de 1977"".";;Osmar Terra;RS;MDB;16/08/2018;Tramitando em Conjunto;/proposicoesWeb/fichadetramitacao?idProposicao=2183279
PL 2509/2019;Altera o art. 18 da Lei nº 13.301 de 26 de junho de 2016, para garantir o acesso ao benefício de prestação continuada da Lei no 8.742, de 7 de dezembro de 1993 por crianças e adolescentes vítimas de microcefalia, síndrome congênita do zika ou outras alterações no crescimento e desenvolvimento relacionadas a etiologias infecciosas transmitidas pelo Aedes aegypti e dá outras providências.;;Natália Bonavides;RN;PT;24/04/2019;Tramitando em Conjunto;/proposicoesWeb/fichadetramitacao?idProposicao=2199214
PL 3486/2019;Institui a Política Nacional de Apoio ao Circo (PNAC).;;Tiririca;SP;PL;12/06/2019;Pronta para Pauta;/proposicoesWeb/fichadetramitacao?idProposicao=2207726
PL 4951/2019;Institui a Política Nacional de Incentivo à Proteção Animal e dá outras providências;;Célio Studart;CE;PV;10/09/2019;Tramitando em Conjunto;/proposicoesWeb/fichadetramitacao?idProposicao=2219523
PL 6004/2013;Regulamenta o art. 37, inciso II, da Constituição Federal, estabelecendo normas gerais para a realização de concursos públicos na Administração Pública direta e indireta dos Poderes da União.;;Senado Federal - Marconi Perillo;GO;PSDB;17/07/2013;Tramitando em Conjunto;/proposicoesWeb/fichadetramitacao?idProposicao=585601
PL 349/2015;Dispõe sobre o combate à violência e à discriminação político-eleitorais contra a mulher.;Altera a Lei nº 4.737, de 1965 e a Lei nº 9.504, de 1997.;Rosangela Gomes;RJ;PRB;11/02/2015;Aguardando Parecer;/proposicoesWeb/fichadetramitacao?idProposicao=946625
PL 5693/2013;Estabelece normas gerais para realização de concurso público pela administração direta, autárquica e fundacional da União.;;Erika Kokay;DF;PT;04/06/2013;Tramitando em Conjunto;/proposicoesWeb/fichadetramitacao?idProposicao=579172
PL 4379/2012;Estabelece normas gerais para realização de concurso público pela administração direta, autárquica e fundacional da União.;;Paulo Tadeu;DF;PT;04/09/2012;Tramitando em Conjunto;/proposicoesWeb/fichadetramitacao?idProposicao=554260
PL 4522/2019;"Acrescenta ao calendário oficial a ""Semana Nacional de Conscientização sobre os Direitos das Empregadas Domésticas"", a ser celebrada anualmente na semana do dia 27 de abril, e dá outras providências.";;Emanuel Pinheiro Neto;MT;PTB;15/08/2019;Aguardando Parecer;/proposicoesWeb/fichadetramitacao?idProposicao=2215641
