Câmara dos Deputados;;;;;;;;
PRL 5 CSSF => PL 831/2007;Parecer da Relatora, Dep. Cida Diogo (PT-RJ), pela rejeição.;;Cida Diogo;RJ;PT;08/11/2010;;/proposicoesWeb/fichadetramitacao?idProposicao=485767
PRL 1 MESA => RIC 5366/2010;Parecer do Relator, Dep. Marco Maia (PT-RS), pela aprovação.;;Marco Maia;RS;PT;22/11/2010;;/proposicoesWeb/fichadetramitacao?idProposicao=487283
PRL 1 PL803510 => PL 8035/2010;"1) pela inconstitucionalidade das emendas n.º 9, 12, 150, 151, 152, 455, 463, 538, 556, 760, 765, 854, 855, 1006, 1011, 1015, 1060, 1193, 1198, 1308, 1318, 1477, 1481, 1568, 1572, 1698, 1700, 1702, 1703, 1707, 2008, 2009, 2012, 2016, 2021, 2492, 2493, 2496, 2684, 2783, 2824, 2879, 2883, 2906; e pela constitucionalidade, juridicidade e boa técnica legislativa do Projeto de Lei n.º 8.035, de 2011, bem como das demais emendas a ele apresentadas; 2) pela incompatibilidade com as normas orçamentárias ...";;Angelo Vanhoni;PR;PT;05/12/2011;;/proposicoesWeb/fichadetramitacao?idProposicao=529949
SBT 1 PL803510 => PL 8035/2010;1 COMISSÃO ESPECIAL DESTINADA A PROFERIR PARECER AO PROJETO DE LEI N.º 8.035, de 2010 ? PLANO NACIONAL DE EDUCAÇÃO PROJETO DE LEI No 8.035, DE 2010 Aprova o Plano Nacional de educação para o decênio 2011-2020 e dá outras providências Autor: PODER EXECUTIVO Relator: Deputado ÂNGELO VANHONI I ? RELATÓRIO A Presidente da República, por meio da Mensagem n.º 701/2010, apresentada em 20/12/2010 ao Congresso Nacional, submeteu à deliberação deste Parlamento o texto do Projeto de Lei ...;;Angelo Vanhoni;PR;PT;05/12/2011;;/proposicoesWeb/fichadetramitacao?idProposicao=529945
REL 3/2011 CEDROGA;Relatório da Comissão.;;POLÍTICAS PÚBLICAS DE COMBATE ÀS DROGAS;;;12/12/2011;Aguardando Providências Internas;/proposicoesWeb/fichadetramitacao?idProposicao=531350
ESB 244 PL803510 => SBT 1 PL803510 => PL 8035/2010;Fica aprovado o Plano Nacional de Educação- PNE, com vigência por dez anos, a contar da aprovação desta Lei, na forma da alteração proposta.;;Ivan Valente;SP;PSOL;14/12/2011;;/proposicoesWeb/fichadetramitacao?idProposicao=532350
PRL 1 CCJC => PL 3035/2008;Parecer do Relator, Dep. Moreira Mendes (PPS-RO), pela inconstitucionalidade, injuridicidade e boa técnica legislativa deste e do Substitutivo da Comissão de Trabalho, de Administração e Serviço Público.;;Moreira Mendes;RO;PPS;08/06/2011;;/proposicoesWeb/fichadetramitacao?idProposicao=508071
PRL 2 CSSF => PL 5741/2001;Parecer da Relatora, Dep. Celia Rocha (PTB-AL), pela aprovação do Substitutivo do Senado Federal ao PL 5741/2001.;;Celia Rocha;AL;PTB;15/06/2011;;/proposicoesWeb/fichadetramitacao?idProposicao=509171
EMC 1799/2011 PL803510 => PL 8035/2010;Aprova o Plano Nacional de Educação para o decênio 2011-2020 e dá outras providências.;;Hugo Leal;RJ;PSC;07/06/2011;;/proposicoesWeb/fichadetramitacao?idProposicao=506916
EMC 1829/2011 PL803510 => PL 8035/2010;Aprova o Plano Nacional de Educação para o decênio 2011-2020 e dá outras providências.;;Hugo Leal;RJ;PSC;07/06/2011;;/proposicoesWeb/fichadetramitacao?idProposicao=506948
EMC 1828/2011 PL803510 => PL 8035/2010;Aprova o Plano Nacional de Educação para o decênio 2011-2020 e dá outras providências.;;Hugo Leal;RJ;PSC;07/06/2011;;/proposicoesWeb/fichadetramitacao?idProposicao=506947
EMC 2208/2011 PL803510 => PL 8035/2010;Modifique-se a Meta 1 do Anexo do Projeto de Lei nº 8035, de 2010, e dê-se a seguinte redação:;;Nelson Marchezan Junior;RS;PSDB;07/06/2011;;/proposicoesWeb/fichadetramitacao?idProposicao=507455
PRL 1 CSSF => PL 7158/2010;Parecer da Relatora, Dep. Sueli Vidigal (PDT-ES), pela aprovação.;;Sueli Vidigal;ES;PDT;15/06/2011;;/proposicoesWeb/fichadetramitacao?idProposicao=509079
EMC 1800/2011 PL803510 => PL 8035/2010;Aprova o Plano Nacional de Educação para o decênio 2011-2020 e dá outras providências.;;Hugo Leal;RJ;PSC;07/06/2011;;/proposicoesWeb/fichadetramitacao?idProposicao=506888
SBT 1 CSSF => PL 5936/2009;CÂMARA DOS DEPUTADOS COMISSÃO DE SEGURIDADE SOCIAL E FAMÍLIA PROJETO DE LEI No 5.936, DE 2009 Altera a redação da Consolidação das Leis do Trabalho ? CLT, aprovada pelo Decreto-lei nº 5.452, de 1º de maio de 1943, para vedar a dispensa arbitrária ou sem justa causa do trabalhador cuja esposa ou companheira gestante não goze do mesmo benefício. Autor: Deputado SABINO CASTELO BRANCO Relator: Deputado PEPE VARGAS I - RELATÓRIO De acordo com o art. 10, ...;;Pepe Vargas;RS;PT;08/07/2011;;/proposicoesWeb/fichadetramitacao?idProposicao=511986
PRL 2 CSSF => PL 5936/2009;Parecer do Relator, Dep. Pepe Vargas (PT-RS), pela aprovação deste, e do PL 989/2011, apensado, com substitutivo.;;Pepe Vargas;RS;PT;08/07/2011;;/proposicoesWeb/fichadetramitacao?idProposicao=511987
PRL 1 CDEICS => PL 1164/2011;Parecer do Relator, Dep. Dr. Ubiali (PSB-SP), pela aprovação deste e do PL 1.464/2011, apensado, com substitutivo.;;Dr. Ubiali;SP;PSB;03/08/2011;;/proposicoesWeb/fichadetramitacao?idProposicao=513788
PRL 0 CSSF => PL 4693/2009;Parecer do Relator, Dep. Benedita da Silva (pendente de análise);;Benedita da Silva;RJ;PT;03/08/2011;;/proposicoesWeb/fichadetramitacao?idProposicao=513733
SBT 1 CSSF => PL 7787/2010;Revoga o art. 1.520 da Lei n.º 10.406, de 10 de janeiro de 2002 (Código Civil), para excluir a possibilidade de extinção da punibilidade criminal pelo casamento.;;Cida Borghetti;PR;PP;03/08/2011;;/proposicoesWeb/fichadetramitacao?idProposicao=513818
PRL 3 CSSF => PL 856/2007;Parecer do Relator, Dep. Mandetta (DEM-MS), pela aprovação deste, e do PL 808/2011, apensado, com substitutivo.;;Mandetta;MS;DEM;24/08/2011;;/proposicoesWeb/fichadetramitacao?idProposicao=517104
VTS 1 CTASP => MSC 59/2008;"""submete à apreciação do Congresso Nacional o texto da Convenção nº 158, de 1982, da Organização Internacional do Trabalho - OIT, sobre Término da Relação de Trabalho por iniciativa do Empregador"".";;Assis Melo;RS;PCdoB;03/08/2011;;/proposicoesWeb/fichadetramitacao?idProposicao=513489
PRL 1 CSSF => PL 3783/2008;Parecer da Relatora, Dep. Jandira Feghali (PCdoB-RJ), pela aprovação, com substitutivo.;;Jandira Feghali;RJ;PCdoB;30/08/2011;;/proposicoesWeb/fichadetramitacao?idProposicao=517862
VTS 1 CTASP => PL 7971/2010;"""Acrescenta artigo à Consolidação das Leis do Trabalho para vedar a dispensa do empregado indicado como testemunha em juízo.""";;Ronaldo Nogueira;RS;PTB;30/08/2011;;/proposicoesWeb/fichadetramitacao?idProposicao=517632
SBT 3 CSSF => PL 856/2007;Estabelece a obrigatoriedade das farmácias e ervanárias a incluírem bula em seus medicamentos.;;Mandetta;MS;DEM;26/08/2011;;/proposicoesWeb/fichadetramitacao?idProposicao=517530
VTS 1 CAPADR => PL 1811/2011;"Acrescenta dispositivo à Lei nº 8.072, de 25 de julho de 1990, que ""dispõe sobre crimes hediondos, nos termos do art. 5º, inciso XLIII, da Constituição Federal, e determina outras providências"".";;Jesus Rodrigues;PI;PT;21/09/2011;;/proposicoesWeb/fichadetramitacao?idProposicao=520530
PRL 1 CTASP => PL 7158/2010;Parecer do Relator, Dep. Leonardo Quintão (PMDB-MG), pela aprovação.;;Leonardo Quintão;MG;PMDB;26/10/2011;;/proposicoesWeb/fichadetramitacao?idProposicao=525200
EMR 1 CSSF => PL 797/2011;COMISSÃO DE SEGURIDADE SOCIAL E FAMÍLIA PROJETO DE LEI No 797, DE 2011 Inclui nos programas Sociais e Financeiros do Governo programa específico de apoio à mulher e a adolescente, nos casos de gravidez oriunda de estupro e nos casos de comprovada má formação do feto. Autora: Deputada LAURIETE Relator: Deputado PASTOR MARCO FELICIANO I ? RELATÓRIO O Projeto de Lei nº 797, de 2011, visa a incluir programa específico de apoio à mulher e à adolescente, nos casos de gravidez oriunda ...;;Pastor Marco Feliciano;SP;PSC;13/06/2012;;/proposicoesWeb/fichadetramitacao?idProposicao=547984
CVO 2 PL803510 => PL 8035/2010;"Parecer com Complementação de Voto, Dep. Angelo Vanhoni (PT-PR), pela adequação financeira e orçamentária deste, pela constitucionalidade, juridicidade e técnica legislativa; pela não implicação da matéria com aumento ou diminuição da receita ou da despesa públicas, não cabendo pronunciamento quanto à adequação financeira e orçamentária; e, no mérito, pela rejeição da Emenda ao Substitutivo 1 ao SBT 1 PL803510, da Emenda ao Substitutivo 2 ao SBT 1 PL803510, da Emenda ao Substitutivo 4 ao SBT 1 P ...";;Angelo Vanhoni;PR;PT;12/06/2012;;/proposicoesWeb/fichadetramitacao?idProposicao=547490
SBT 5 PL803510 => PL 8035/2010;Substitutivo integrante do Parecer Reformulado;;Angelo Vanhoni;PR;PT;26/06/2012;;/proposicoesWeb/fichadetramitacao?idProposicao=551588
PRR 1 PL803510 => PL 8035/2010;Parecer Reformulado do Deputado Angelo Vanhoni (PT/PR), com substitutivo.;;Angelo Vanhoni;PR;PT;26/06/2012;;/proposicoesWeb/fichadetramitacao?idProposicao=551589
RDF 1 CCJC => PL 2844/2011;C Â M A R A D O S D E P U T A D O S COMISSÃO DE CONSTITUIÇÃO E JUSTIÇA E DE CIDADANIA REDAÇÃO FINAL PROJETO DE LEI Nº 2.844-C DE 2011 Dispõe sobre os requisitos para ingresso nos cursos de formação de militares de carreira do Exército. EMEMDA DE REDAÇÃO Dê-se ao art. 7º a seguinte redação: ?Art. 7º O ingresso na linha militar bélica de ensino permitido a candidatos do sexo feminino deverá ser viabilizado em até 5 (cinco) anos a contar da data de pu- blicação desta ...;;Osmar Serraglio;PR;PMDB;01/06/2012;;/proposicoesWeb/fichadetramitacao?idProposicao=546838
RDF 1 CCJC => PL 2843/2011;C Â M A R A D O S D E P U T A D O S COMISSÃO DE CONSTITUIÇÃO E JUSTIÇA E DE CIDADANIA REDAÇÃO FINAL PROJETO DE LEI Nº 2.843-C DE 2011 Altera a Lei nº 11.279, de 9 de fevereiro de 2006, que dispõe sobre o ensino na Marinha, no que se refere aos requisitos para ingresso nas Carreiras da Marinha. O CONGRESSO NACIONAL decreta: Art. 1º A Lei nº 11.279, de 9 de fevereiro 2006, passa a vigorar acrescida do seguinte Capítulo II-A: ?CAPÍTULO II-A DOS REQUISITOS DE INGRESSO NA ...;;Osmar Serraglio;PR;PMDB;01/06/2012;;/proposicoesWeb/fichadetramitacao?idProposicao=546837
SBT 4 PL803510 => PL 8035/2010;COMISSÃO ESPECIAL DESTINADA A PROFERIR PARECER AO PROJETO DE LEI N.º 8.035, de 2010 ? PLANO NACIONAL DE EDUCAÇÃO COMPLEMENTAÇÃO DE VOTO Após a análise das quatrocentas e quarenta e cinco emendas válidas ao Substitutivo 1, e apresentação do Substitutivo 2 foram oferecidos 155 destaques, que propiciaram o aprofundamento de temas e a construção de consensos. Mantivemos abertos os canais de diálogo com o Poder Executivo, os movimentos sociais e os nobres colegas parlamentares ...;;Angelo Vanhoni;PR;PT;14/06/2012;;/proposicoesWeb/fichadetramitacao?idProposicao=548196
PRL 1 CSSF => PL 1145/2011;Parecer da Relatora, Dep. Teresa Surita (PMDB-RR), pela aprovação, com substitutivo.;;Teresa Surita;RR;PMDB;02/07/2012;;/proposicoesWeb/fichadetramitacao?idProposicao=550128
SBT 1 CSSF => PL 1145/2011;COMISSÃO DE SEGURIDADE SOCIAL E FAMÍLIA PROJETO DE LEI N o 1.145, DE 2011 Acrescenta art. 392-B à Consolidação das Leis do Trabalho para dispor sobre a licença maternidade das mulheres que trabalham em equipagens de embarcações da marinha mercante, de navegação fluvial e lacustre, de tráfego nos portos e de pesca. Autor: Deputado CARLOS BEZERRA Relatora: Deputada TERESA SURITA I - RELATÓRIO O Projeto de Lei em epígrafe inclui art. 392-B na Consolidação das Leis do Trabalho ? CLT ...;;Teresa Surita;RR;PMDB;02/07/2012;;/proposicoesWeb/fichadetramitacao?idProposicao=550129
PRL 1 CSSF => PL 1579/2007;Parecer da Relatora, Dep. Teresa Surita (PMDB-RR), pela rejeição deste, do PL 1685/2007, do PL 1839/2007, do PL 2192/2007, do PL 5865/2009, do PL 6312/2009, do PL 6509/2009, e do PL 1528/2011, apensados, com substitutivo, e pela aprovação do PL 3520/2008, do PL 5691/2009, do PL 6881/2010, e do PL 1409/2011, apensados.;;Teresa Surita;RR;PMDB;05/07/2012;;/proposicoesWeb/fichadetramitacao?idProposicao=550833
SBT 1 CSSF => PL 1579/2007;"Altera a Lei nº 10.836, de 09 de janeiro de 2004, que ""cria o Programa Bolsa Família e dá outras providências"", para dispor sobre o Programa de Assistência às Adolescentes Gestantes.";;Teresa Surita;RR;PMDB;05/07/2012;;/proposicoesWeb/fichadetramitacao?idProposicao=550837
PRL 1 CCJC => PL 5896/2009;Parecer do Relator, Dep. Luiz Couto (PT-PB), pela constitucionalidade, juridicidade e técnica legislativa deste e das Emendas da Comissão de Seguridade Social e Família.;;Luiz Couto;PB;PT;10/07/2012;;/proposicoesWeb/fichadetramitacao?idProposicao=551388
PRL 1 CCJC => PL 7158/2010;Parecer do Relator, Dep. Ronaldo Fonseca (PR-DF), pela constitucionalidade, juridicidade e técnica legislativa.;;Ronaldo Fonseca;DF;PR;28/08/2012;;/proposicoesWeb/fichadetramitacao?idProposicao=554092
PRL 1 CFT => PL 2110/2007;"Parecer do relator, Dep. Guilherme Campos, pela não implicação da matéria com aumento ou diminuição da receita ou da despesa públicas, não cabendo pronunciamento quanto à adequação financeira e orçamentária; e, no mérito, pela rejeição.";;Guilherme Campos;SP;PSD;23/08/2012;;/proposicoesWeb/fichadetramitacao?idProposicao=553930
SBT 1 PL602505 => PL 6025/2005;"COMISSÃO ESPECIAL DESTINADA A PROFERIR PARECER AO PROJETO DE LEI NO 6.025, DE 2005, AO PROJETO DE LEI NO 8.046, DE 2010, AMBOS DO SENADO FEDERAL, E OUTROS, QUE TRATAM DO ?CÓDIGO DE PROCESSO CIVIL? (REVOGAM A LEI NO 5.869, DE 1973). PROJETOS DE LEI NOS 6.025, DE 2005, E 8.046, DE 2010 (Em apenso os Projetos de Lei n.ºs 3.804, de 1993; 4.627, de 1994; 504 e 1.201, de 1995; 1.489, 1.823, 1.824 e 2.624, de 1996; 4.720, de 1998; 360, 484, 486, 487, 490, 491, 492, 493, 494, 496, 507, 508, ...";;Sérgio Barradas Carneiro;BA;PT;18/09/2012;;/proposicoesWeb/fichadetramitacao?idProposicao=556026
PRL 1 PL602505 => PL 6025/2005;Parecer pela: a) constitucionalidade, juridicidade, adequada técnica legislativa e, no mérito, pela rejeição das Emendas n.ºs 1, 9, 10, 11, 12, 13, 14, 15, 17, 18, 20, 21, 22, 24, 26, 27, 32, 33, 34, 35, 37, 39, 40, 41, 42, 44, 45, 46, 47, 48, 49, 50, 51, 52, 54, 55, 56, 57, 58, 59, 60, 61, 62, 63, 65, 66, 67, 68, 69, 72, 73, 74, 78, 79, 83, 84, 85, 88, 89, 90, 91, 95, 98, 102, 103, 104, 105, 107, 108, 110, 111, 112, 115, 117, 119, 120, 121, 122, 123, 124, 126, 128, 129, 131, 132, 133, 134, 135, ...;;Sérgio Barradas Carneiro;BA;PT;18/09/2012;;/proposicoesWeb/fichadetramitacao?idProposicao=556027
SBT 2 PL602505 => PL 6025/2005;"PARECER AO PROJETO DE LEI NO 6.025, DE 2005, AO PROJETO DE LEI NO 8.046, DE 2010, AMBOS DO SENADO FEDERAL, E OUTROS, QUE TRATAM DO ""CÓDIGO DE PROCESSO CIVIL"" (REVOGAM A LEI NO 5.869, DE 1973).";;Sérgio Barradas Carneiro;BA;PT;11/10/2012;;/proposicoesWeb/fichadetramitacao?idProposicao=556939
PRL 1 CE => PL 512/2011;Parecer da Relatora, Dep. Alice Portugal (PCdoB-BA), pela aprovação.;;Alice Portugal;BA;PCdoB;10/10/2012;;/proposicoesWeb/fichadetramitacao?idProposicao=556781
PRL 1 CSSF => PL 3812/2012;Parecer da Relatora, Dep. Elcione Barbalho (PMDB-PA), pela aprovação.;;Elcione Barbalho;PA;PMDB;10/10/2012;;/proposicoesWeb/fichadetramitacao?idProposicao=556754
PRL 1 CSSF => PL 6717/2009;Parecer do Relator, Dep. Onofre Santo Agostini (PSD-SC), pela aprovação deste, do PL 4461/2008, do PL 4467/2008, do PL 5752/2009, e do PL 3445/2008, apensados.;;Onofre Santo Agostini;SC;PSD;09/10/2012;;/proposicoesWeb/fichadetramitacao?idProposicao=556542
EMS 5741/2001 => PL 5741/2001;Substitutivo do Senado ao Projeto de Lei da Câmara nº 100, de 2007 (PL nº 5.741, de 2001, na Casa de origem), que Dispõe sobre a criação dos Comitês de Estudos e Prevenção à Mortalidade Materna. Substitua-se o Projeto pelo seguinte: Dispõe sobre a criação de comitês de estudos e de prevenção da mortalidade materna.;;Senado Federal;;;30/03/2011;;/proposicoesWeb/fichadetramitacao?idProposicao=496676
PRL 2 CTASP => PL 1164/2011;Parecer do Relator, Dep. Luciano Castro (PR-RR), pela aprovação deste e do PL 1464/11, apensado, na forma do Substitutivo aprovado na CDEIC.;;Luciano Castro;RR;PR;30/09/2013;;/proposicoesWeb/fichadetramitacao?idProposicao=593912
PRL 2 CSSF => PLP 131/2012;Parecer do Relator, Dep. José Linhares (PP-CE), pela aprovação.;;José Linhares;CE;PP;18/10/2013;;/proposicoesWeb/fichadetramitacao?idProposicao=597458
PRL 2 CSSF => PL 5666/2013;Parecer do Relator, Dep. Dr. Ubiali (pendente de análise);;Dr. Ubiali;SP;PSB;24/10/2013;;/proposicoesWeb/fichadetramitacao?idProposicao=598153
RDF 1 CCJC => PL 856/2007;C Â M A R A D O S D E P U T A D O S COMISSÃO DE CONSTITUIÇÃO E JUSTIÇA E DE CIDADANIA REDAÇÃO FINAL PROJETO DE LEI Nº 856-C DE 2007 Dispõe sobre a obrigatoriedade de as farmácias incluírem bula nos medicamentos manipulados. O CONGRESSO NACIONAL decreta: Art. 1º Esta Lei estabelece a obrigatoriedade de as farmácias incluírem bula nos medicamentos que manipulam. Art. 2º Os medicamentos produzidos por farmácias deverão vir acompanhados de bula que informe e oriente o usuário ...;;Luiza Erundina;SP;PSB;29/11/2013;;/proposicoesWeb/fichadetramitacao?idProposicao=602728
SBT-A 1 CSSF => PL 3783/2008;Acrescenta parágrafo ao art. 392 da Consolidação das Leis do Trabalho - CLT, aprovada pelo Decreto-Lei nº 5.452, de 1º de maio de 1943, bem como §§ 1º e 2º ao art. 71 da Lei nº 8.213, de 24 de julho de 1991, para assegurar à mãe trabalhadora a continuidade da estabilidade provisória e do benefício do salário-maternidade em caso de falecimento do filho.;;SEGURIDADE SOCIAL E FAMÍLIA;;;27/11/2013;;/proposicoesWeb/fichadetramitacao?idProposicao=602969
PRL 2 CSSF => PL 1145/2011;Parecer do Relator, Dep. Antonio Brito (PTB-BA), pela aprovação, com substitutivo.;;Antonio Brito;BA;PTB;05/12/2013;;/proposicoesWeb/fichadetramitacao?idProposicao=603448
PRL 1 CSSF => PL 512/2011;Parecer do Relator, Dep. Geraldo Resende (PMDB-MS), pela aprovação.;;Geraldo Resende;MS;PMDB;22/03/2012;;/proposicoesWeb/fichadetramitacao?idProposicao=538572
REL 1/2012 CEALCOOL;Relatório da Comissão Especial para efetuar estudo sobre as causas e consequências do consumo abusivo de álcool ente cidadãos brasileiros e, especialmente. as razões que determinam o aumento exponencial nos úlitmos cinco anos.;;Vanderlei Macris;SP;PSDB;20/03/2012;Pronta para Pauta;/proposicoesWeb/fichadetramitacao?idProposicao=537806
ESP 1/2012 => PL 4247/2008;Consolida a legislação sanitária federal.;;José Mentor;SP;PT;01/03/2012;;/proposicoesWeb/fichadetramitacao?idProposicao=535710
SBT 2 PL803510 => PL 8035/2010;COMISSÃO ESPECIAL DESTINADA A PROFERIR PARECER AO PROJETO DE LEI N.º 8.035, de 2010 ? PLANO NACIONAL DE EDUCAÇÃO PARECER ÀS EMENDAS AO SUBSTITUTIVO AO PROJETO DE LEI nº 8.035, DE 2010 - PNE Após a primeira fase da tramitação do Projeto de Lei nº 8.035, de 2010, referente ao Plano Nacional de Educação-PNE, procedemos à análise de cerca de três mil emendas e oferecemos Substitutivo à consideração dos pares. Nos termos do Art. 119, caput, I, do Regimento Interno da Câmara dos ...;;Angelo Vanhoni;PR;PT;24/04/2012;;/proposicoesWeb/fichadetramitacao?idProposicao=542181
PRL 1 CSSF => PL 1618/2011;Parecer do Relator, Dep. Roberto de Lucena (PV-SP), pela rejeição.;;Roberto de Lucena;SP;PV;20/04/2012;;/proposicoesWeb/fichadetramitacao?idProposicao=542028
PRL 1 CSSF => PL 797/2011;Parecer do Relator, Dep. Pastor Marco Feliciano (PSC-SP), pela aprovação, com emenda.;;Pastor Marco Feliciano;SP;PSC;31/05/2012;;/proposicoesWeb/fichadetramitacao?idProposicao=546712
REQ 5129/2012 => PEC 3/2011;Requer ao Presidente da Câmara dos Deputados, Sr. Marco Maia, retirada de assinatura no PEC 03/2011.;;Jean Wyllys;RJ;PSOL;03/05/2012;;/proposicoesWeb/fichadetramitacao?idProposicao=543377
PRL 1 CSSF => PLP 131/2012;Parecer do Relator, Dep. Neilton Mulim (PR-RJ), pela aprovação.;;Neilton Mulim;RJ;PR;17/05/2012;;/proposicoesWeb/fichadetramitacao?idProposicao=545044
PRL 3 CSSF => PL 730/2011;Parecer da Relatora, Dep. Rosinha da Adefal (PTdoB-AL), pela aprovação.;;Rosinha da Adefal;AL;PTdoB;25/05/2012;;/proposicoesWeb/fichadetramitacao?idProposicao=545898
CVO 1 PL803510 => PL 8035/2010;Parecer com Complementação de Voto, Dep. Angelo Vanhoni (PT-PR), com Substitutivo.;;Angelo Vanhoni;PR;PT;29/05/2012;;/proposicoesWeb/fichadetramitacao?idProposicao=546101
VTS 1 PL803510 => PL 8035/2010;Aprova o Plano Nacional de Educação para o decênio 2011-2020, e dá outras providências.;;Ivan Valente;SP;PSOL;29/05/2012;;/proposicoesWeb/fichadetramitacao?idProposicao=546087
PRP 1 PL602505 => PL 6025/2005;Parecer do Relator-Parcial, Dep. Bonifácio de Andrada (PSDB-MG), com emendas.;;Bonifácio de Andrada;MG;PSDB;08/05/2012;;/proposicoesWeb/fichadetramitacao?idProposicao=543771
REL 2/2014 CPITRAB => RCP 11/2012;RELATÓRIO FINAL - Comissão Parlamentar de Inquérito destinada a apurar a exploração do trabalho infantil no Brasil e dá outras providências - CPITRAB;;Luciana Santos;PE;PCdoB;08/12/2014;Aguardando Providências Internas;/proposicoesWeb/fichadetramitacao?idProposicao=818079
PRL 1 CSSF => PL 6022/2013;Parecer do Relator, Dep. Dr. Rosinha (PT-PR), pela aprovação deste, e pela rejeição da Emenda 1/2013 da CSSF, da Emenda 2/2013 da CSSF, da Emenda 3/2013 da CSSF, do PL 6033/2013, do PL 6061/2013, e do PL 6055/2013, apensados.;;Dr. Rosinha;PR;PT;17/12/2014;;/proposicoesWeb/fichadetramitacao?idProposicao=858798
SBT 2 PL699813 => PL 6998/2013;Altera o art. 1º e insere dispositivos sobre a Primeira Infância na Lei nº 8.069, de 1990, que dispõe sobre o Estatuto da Criança e do Adolescente e dá outras providências.;;João Ananias;CE;PCdoB;10/12/2014;;/proposicoesWeb/fichadetramitacao?idProposicao=836514
PES 1 PL699813 => PL 6998/2013;Parecer às emendas apresentadas ao Substitutivo do Relator, Dep. João Ananias (PCdoB-CE), pela constitucionalidade, juridicidade, boa técnica legislativa e adequação orçamentária e financeira das 25 emendas apresentadas ao substitutivo, e, no mérito, pela aprovação das nºs 1, 3, 4, 5, 6, 8, 12 a 25, e pela rejeição das de nºs 2, 7, 9, 10 e 11, com substitutivo.;;João Ananias;CE;PCdoB;10/12/2014;;/proposicoesWeb/fichadetramitacao?idProposicao=836513
RDF 1 => PL 60/1999;C Â M A R A D O S D E P U T A D O S REDAÇÃO FINAL PROJETO DE LEI Nº 60-C DE 1999 Dispõe sobre o atendimento obrigatório e integral de pessoas em situação de violência sexual. O CONGRESSO NACIONAL decreta: Art. 1º Os hospitais devem oferecer às vítimas de violência sexual atendimento emergencial, integral e multidis- ciplinar, visando ao controle e ao tratamento dos agravos fí- sicos e psíquicos decorrentes de violência sexual, e encami- nhamento, se for o caso, aos serviços de assistência social ...;;Eliseu Padilha;RS;PMDB;05/03/2013;;/proposicoesWeb/fichadetramitacao?idProposicao=566564
RDF 1 CCJC => PL 5896/2009;C Â M A R A D O S D E P U T A D O S COMISSÃO DE CONSTITUIÇÃO E JUSTIÇA E DE CIDADANIA REDAÇÃO FINAL PROJETO DE LEI Nº 5.896-E DE 2009 Dispõe sobre a licença à gestante e à adotante, as medidas de prote- ção à maternidade para militares grávidas e a licença-paternidade, no âmbito das Forças Armadas. O CONGRESSO NACIONAL decreta: Art. 1º Será concedida licença à gestante, no âm- bito das Forças Armadas, conforme o previsto no inciso XVIII do art. 7º da Constituição Federal, ...;;Alessandro Molon;RJ;PT;17/04/2013;;/proposicoesWeb/fichadetramitacao?idProposicao=572619
PRL 1 CTASP => PL 1780/2007;Parecer do Relator, Dep. Roberto Balestra (PP-GO), pela rejeição deste e dos PLs nºs 7.217/10, 727/11, 3.797/12, 2.073/11, 5.180/13, 3.987/12, 4.816/12 e 5.221/13, apensados.;;Roberto Balestra;GO;PP;08/05/2013;;/proposicoesWeb/fichadetramitacao?idProposicao=576017
PRL 2 CSSF => PL 6718/2009;Parecer do Relator, Dep. Marcus Pestana (PSDB-MG), pela aprovação.;;Marcus Pestana;MG;PSDB;04/06/2013;;/proposicoesWeb/fichadetramitacao?idProposicao=579140
VTS 1 CSSF => PL 1683/2007;Dispõe sobre a adição de ácido fólico no açúcar.;;Pastor Eurico;PE;PSB;02/07/2013;;/proposicoesWeb/fichadetramitacao?idProposicao=582571
PRL 5 PL602505 => PL 6025/2005;Parecer do Relator, Dep. Paulo Teixeira (PT-SP), com Substitutivo: a) pela constitucionalidade, juridicidade, adequada técnica legislativa e, no mérito, pela rejeição das Emendas números 1, 9, 10, 11, 12, 13, 14, 15, 17, 18, 20, 21, 22, 24, 26, 27, 32, 33, 34, 37, 39, 40, 41, 42, 44, 45, 46, 47, 48, 49, 50, 51, 52, 54, 55, 56, 57, 58, 59, 60, 61, 62, 63, 65, 66, 67, 68, 69, 72, 73, 74, 75, 78, 79, 83, 84, 85, 88, 89, 90, 91, 95, 98, 102, 103, 104, 105, 107, 108, 110, 111, 112, 115, 117, 119, 120 ...;;Paulo Teixeira;SP;PT;02/07/2013;;/proposicoesWeb/fichadetramitacao?idProposicao=582588
VTS 3 CCJC => MSC 59/2008;Submete à apreciação do Congresso Nacional o texto da Convenção nº 158, de 1982, da Organização Internacional do Trabalho - OIT, sobre Término da Relação de Trabalho por iniciativa do Empregador.;;Vieira da Cunha;RS;PDT;05/11/2014;;/proposicoesWeb/fichadetramitacao?idProposicao=737644
SBT 4 CCJC => PL 5069/2013;Acrescenta o art. 127-A ao Decreto-Lei nº 2.848, de 7 de dezembro de 1940 - Código Penal. Explicação: Tipifica como crime contra a vida o anúncio de meio abortivo e prevê penas específicas para quem induz a gestante à prática de aborto.;;Evandro Gussi;SP;PV;14/10/2015;;/proposicoesWeb/fichadetramitacao?idProposicao=2017637
CVO 2 CCJC => PL 5069/2013;"Parecer com Complementação de Voto, Dep. Evandro Gussi (PV-SP), pela constitucionalidade, juridicidade e técnica legislativa; e, no mérito, pela aprovação, com substitutivo.";;Evandro Gussi;SP;PV;14/10/2015;;/proposicoesWeb/fichadetramitacao?idProposicao=2017634
