Câmara dos Deputados;;;;;;;;
"Relatório de Proposições
Resultado da Pesquisa";;;;;;;;
Proposições;Ementa;Explicação ;Autor;UF;Partido;Apresentaç;Situação;Link 
PL 166/2011;Dispõe sobre a criação de Casas Apoio destinadas ao atendimento de adolescentes grávidas.;;"Weliton Prado;Ricardo Izar";"MG;SP";"PT;PP";07/02/2011;Aguardando Designação de Relator;/proposicoesWeb/fichadetramitacao?idProposicao=491186
PL 5745/2016;Obriga a criação do Programa Nacional de Prevenção à Gravidez Precoce.;;Felipe Bornier;RJ;PROS;05/07/2016;Tramitando em Conjunto;/proposicoesWeb/fichadetramitacao?idProposicao=2090372
RIC 42/2020;Requer à Ministra de Estado da Mulher, da Família e dos Direitos Humanos, informações sobre os gastos com a campanha pela abstinência sexual.;;Alexandre Padilha;SP;PT;05/02/2020;"Aguardando Remessa ao Arquivo;Aguardando Deliberação";/proposicoesWeb/fichadetramitacao?idProposicao=2236628
RIC 32/2020;Requer informações ao Senhor Ministro de Estado da Saúde relacionadas à Lei 13.798/2019.;;Diego Garcia;PR;PODE;05/02/2020;"Aguardando Remessa ao Arquivo;Aguardando Deliberação";/proposicoesWeb/fichadetramitacao?idProposicao=2236578
RIC 113/2020;"Solicita à Ministra de Estado da Mulher, da Família e dos Direitos Humanos esclarecimentos acerca da campanha ""Adolescência primeiro, gravidez depois - tudo tem o seu tempo"".";;Sâmia Bomfim;SP;PSOL;17/02/2020;"Aguardando Remessa ao Arquivo;Aguardando Deliberação";/proposicoesWeb/fichadetramitacao?idProposicao=2237605
PL 4024/2015;Introduz o parágrafo quarto no art. 6º da Lei nº 8.742, de 7 de dezembro de 1993 (Lei Orgânica da Assistência Social), para instituir programas de prevenção à gravidez precoce.;;Marcelo Belinati;PR;PP;15/12/2015;Tramitando em Conjunto;/proposicoesWeb/fichadetramitacao?idProposicao=2075021
REQ 29/2020 CEXINFAN;"Requer a realização de Audiência Pública no âmbito desta comissão para debater o tema ""gravidez precoce e planejamento familiar"".";;Paula Belmonte;DF;CIDADANIA;03/03/2020;Aguardando Providências Internas;/proposicoesWeb/fichadetramitacao?idProposicao=2238284
REQ 16/2020 CEXINFAN;Requer informações ao Excelentíssimo Senhor Ministro da Saúde, Senhor Luiz Henrique Mandetta, acerca de dados sobre gravidez precoce.;;Paula Belmonte;DF;CIDADANIA;03/03/2020;Aguardando Providências Internas;/proposicoesWeb/fichadetramitacao?idProposicao=2238270
REQ 17/2020 CEXINFAN;Requer informações ao Excelentíssimo a Senhora Ministra da Mulher, da Família e dos Direitos Humanos, Senhora Damares Alves, acerca de dados sobre gravidez precoce.;;Paula Belmonte;DF;CIDADANIA;03/03/2020;Aguardando Providências Internas;/proposicoesWeb/fichadetramitacao?idProposicao=2238271
PL 6583/2013;Dispõe sobre o Estatuto da Família e dá outras providências.;;Anderson Ferreira;PE;PR;16/10/2013;"Aguardando Deliberação de Recurso;Comissão em funcionamento";/proposicoesWeb/fichadetramitacao?idProposicao=597005
PL 10569/2018;Dispõe sobre a afixação de placas informativas, nas unidades públicas e privadas de saúde, sobre a adoção de nascituro.;Altera a Lei nº 8.069, de 1990.;Herculano Passos;SP;MDB;11/07/2018;"Tramitando em Conjunto;Tramitando em Conjunto";/proposicoesWeb/fichadetramitacao?idProposicao=2181531
PL 6602/2016;"""Altera o Decreto-Lei 5452, de 01 de maio de 1942, que aprova a Consolidação das Leis do Trabalho, para dispor sobre a estabilidade provisória da jovem aprendiz gestante"".";;Francisco Floriano;RJ;DEM;01/12/2016;Tramitando em Conjunto;/proposicoesWeb/fichadetramitacao?idProposicao=2119741
PRL 1 CMULHER => PL 10813/2018;Parecer da relatora, Dep. Rose Modesto, pela aprovação.;;Rose Modesto;MS;PSDB;07/08/2019;;/proposicoesWeb/fichadetramitacao?idProposicao=2214142
PRL 1 MESA => RIC 6/2019;Parecer do Relator, Dep. Marcos Pereira (PRB-SP), pela aprovação.;;Marcos Pereira;SP;PRB;13/02/2019;;/proposicoesWeb/fichadetramitacao?idProposicao=2192062
PL 2350/2015;"Dá nova redação à Lei nº 6.202, de 17 de abril de 1975, que ""Atribui à estudante em estado de gestação o regime de exercícios domiciliares instituído pelo Decreto-lei nº 1.044, de 1969, e dá outras providências"" e à Lei nº 9.394, de 20 de dezembro de 1996, que ""Estabelece as diretrizes e bases da educação nacional"", para assegurar os direitos educacionais às gestantes. NOVA EMENTA: Altera a Lei nº 6.202, de 17 de abril de 1975, que atribui à estudante em estado de gestação o regime de exercícios ...";;Jean Wyllys;RJ;PSOL;14/07/2015;Aguardando Apreciação pelo Senado Federal;/proposicoesWeb/fichadetramitacao?idProposicao=1579163
PRL 1 CE => PL 6/2015;Parecer do Relator, Dep. Floriano Pesaro (PSDB-SP), pela aprovação deste e das Emendas Adotadas pela Comissão de Seguridade Social e Família - CSSF.;;Floriano Pesaro;SP;PSDB;04/06/2018;;/proposicoesWeb/fichadetramitacao?idProposicao=2177453
PRL 1 CCJC => REC 34/2011 => PL 1149/2011;Parecer do Relator, Dep. Osmar Serraglio (PMDB-PR), pelo provimento.;;Osmar Serraglio;PR;PMDB;14/07/2011;;/proposicoesWeb/fichadetramitacao?idProposicao=512636
PRL 1 CCJC => PL 512/2011;Parecer do Relator, Dep. Alceu Moreira (PMDB-RS), pela constitucionalidade, juridicidade e técnica legislativa.;;Alceu Moreira;RS;PMDB;18/04/2013;;/proposicoesWeb/fichadetramitacao?idProposicao=572963
EMC 1/2015 CDHM => PL 3369/2015;Institui o Estatuto das Famílias do Século XXI.;;Diego Garcia;PR;PHS;03/12/2015;;/proposicoesWeb/fichadetramitacao?idProposicao=2057987
PRL 1 PL658313 => PL 6583/2013;"Parecer do Relator, Dep. Ronaldo Fonseca (PROS-DF), pela constitucionalidade, juridicidade e boa técnica legislativa dos PLs nºs 6.853/13 e 6.584/13, apensado, e da emenda apresentada na Comissão; e, no mérito, pela aprovação do PL nº 6.853/13 e da emenda apresentada, com substitutivo; e pela rejeição do PL 6.584/13.";;Ronaldo Fonseca;DF;PROS;17/11/2014;;/proposicoesWeb/fichadetramitacao?idProposicao=786555
SBT 1 PL658313 => PL 6583/2013;COMISSÃO ESPECIAL DESTINADA A PROFERIR PARECER AO PROJETO DE LEI Nº 6.583, DE 2013 Dispõe sobre o Estatuto da Família e dá outras providências. Autor: Deputado Anderson Ferreira Relator: Deputado Ronaldo Fonseca I - RELATÓRIO Trata-se de Projeto de Lei, de autoria do ilustre Deputado Anderson Ferreira, para instituir em nosso ordenamento jurídico o Estatuto da Família para dispor sobre os direitos da família e estabelecer diretrizes de políticas públicas para a valorização e ...;;Ronaldo Fonseca;DF;PROS;17/11/2014;;/proposicoesWeb/fichadetramitacao?idProposicao=786558
SBT 3 PL658313 => PL 6583/2013;COMISSÃO ESPECIAL DESTINADA A PROFERIR PARECER AO PROJETO DE LEI Nº 6.583, DE 2013 PROJETO DE LEI Nº 6.583, DE 2013 (Apenso o PL nº 6.584/13) Dispõe sobre o Estatuto da Família e dá outras providências. Autor: Deputado ANDERSON FERREIRA Relator: Deputado DIEGO GARCIA I ? RELATÓRIO Trata-se de Projeto de Lei, de autoria do ilustre Deputado Anderson Ferreira, que pretende instituir em nosso ordenamento jurídico o Estatuto da Família, para dispor sobre os direitos da família e ...;;Diego Garcia;PR;PHS;23/09/2015;;/proposicoesWeb/fichadetramitacao?idProposicao=1756977
VTS 2 PL658313 => PL 6583/2013;Dispõe sobre o Estatuto da Família e dá outras providências.;;Erika Kokay;DF;PT;24/09/2015;;/proposicoesWeb/fichadetramitacao?idProposicao=1758915
PRL 1 CSSF => PL 6/2015;Parecer do Relator, Dep. Elizeu Dionizio (PSDB-MS), pela aprovação.;;Elizeu Dionizio;MS;PSDB;14/06/2017;;/proposicoesWeb/fichadetramitacao?idProposicao=2141609
EMR 2 CSSF => PL 6/2015;Fica instituída a Semana de Orientação sobre a Gravidez na Adolescência, na primeira semana de maio.;;Elizeu Dionizio;MS;PSDB;27/09/2017;;/proposicoesWeb/fichadetramitacao?idProposicao=2153261
EMC-A 1 CSSF => PL 6/2015;"Altera o art. 1º do PL 6/2015, para incluir as expressões ""adolescência e paternidade responsável""";;SEGURIDADE SOCIAL E FAMÍLIA;;;28/09/2017;;/proposicoesWeb/fichadetramitacao?idProposicao=2153426
CVO 1 CSSF => PL 6/2015;Parecer com Complementação de Voto, Dep. Elizeu Dionizio (PSDB-MS), pela aprovação, com emendas.;;Elizeu Dionizio;MS;PSDB;13/09/2017;;/proposicoesWeb/fichadetramitacao?idProposicao=2151318
PL 411/2020;Altera os dispositivos art. 20 da LEI Nº 12.852, DE 5 DE AGOSTO DE 2013 - Estatuto da Juventude, inciso VIII para dispor sobre as diretrizes a serem observadas na formulação de políticas públicas de atenção à saúde do jovem.;;"Lucas Gonzalez;Liziane Bayer;Paula Belmonte";"MG;RS;DF";"NOVO;PSB;CIDADANIA";19/02/2020;;/proposicoesWeb/fichadetramitacao?idProposicao=2237947
PL 1911/2011;Cria Política Pública de Prevenção e Atendimento às Adolescentes e Jovens Grávidas.;;Neilton Mulim;RJ;PR;03/08/2011;Tramitando em Conjunto;/proposicoesWeb/fichadetramitacao?idProposicao=513762
RIC 43/2020;Requer ao Ministro de Estado da Saúde, informações sobre os gastos com a campanha pela abstinência sexual.;;Alexandre Padilha;SP;PT;05/02/2020;"Aguardando Remessa ao Arquivo;Aguardando Deliberação";/proposicoesWeb/fichadetramitacao?idProposicao=2236629
PL 6/2015;Fica instituída a Semana de Orientação sobre a Gravidez na Adolescência, na primeira semana de maio.;;Ricardo Barros;PR;PP;02/02/2015;Aguardando Designação de Relator;/proposicoesWeb/fichadetramitacao?idProposicao=944246
PL 6503/2019;Altera o art. 473 da Consolidação das Leis do Trabalho ? CLT, para dispor sobre ausência ao trabalho em razão das reuniões pedagógicas nas escolas de seus filhos.;Altera o Decreto-lei nº 5.452 de 1943.;Felipe Carreras;PE;PSB;17/12/2019;Tramitando em Conjunto;/proposicoesWeb/fichadetramitacao?idProposicao=2234586
PL 10644/2018;Dispõe sobre a identificação das empresas, que contratam com o Governo Federal, cumpridoras das leis e decretos federais referentes à obrigatoriedade do preenchimento das cotas de aprendizes previstas na Lei 10.097/2000 e no Decreto 5.598 de 2005: com vista a estabelecer sanções às empresas que não observarem os percentuais de cotas e dá outras providências;;"Celso Jacob;Pompeo de Mattos";"RJ;RS";"MDB;PDT";07/08/2018;Tramitando em Conjunto;/proposicoesWeb/fichadetramitacao?idProposicao=2182233
PL 10813/2018;Institui o Programa Nacional de Prevenção à Gravidez Precoce.;Altera a Lei nº 8.742, de 1993.;Mariana Carvalho;RO;PSDB;04/09/2018;Aguardando Parecer;/proposicoesWeb/fichadetramitacao?idProposicao=2183668
REQ 296/2019 CSSF;Requer a realização de Audiência Pública para tratar o tema da gravidez na adolescência no Brasil.;;Dr. Leonardo;MT;SOLIDARI;18/09/2019;Aguardando Providências Internas;/proposicoesWeb/fichadetramitacao?idProposicao=2220807
PL 11230/2018;Dispõe sobre a classificação indicativa em obras audiovisuais, em exposições, mostras de artes visuais e auditivas e dá outras providências.;;Nilson Leitão;MT;PSDB;19/12/2018;"Tramitando em Conjunto;Tramitando em Conjunto";/proposicoesWeb/fichadetramitacao?idProposicao=2189992
PRL 1 PL803510 => PL 8035/2010;"1) pela inconstitucionalidade das emendas n.º 9, 12, 150, 151, 152, 455, 463, 538, 556, 760, 765, 854, 855, 1006, 1011, 1015, 1060, 1193, 1198, 1308, 1318, 1477, 1481, 1568, 1572, 1698, 1700, 1702, 1703, 1707, 2008, 2009, 2012, 2016, 2021, 2492, 2493, 2496, 2684, 2783, 2824, 2879, 2883, 2906; e pela constitucionalidade, juridicidade e boa técnica legislativa do Projeto de Lei n.º 8.035, de 2011, bem como das demais emendas a ele apresentadas; 2) pela incompatibilidade com as normas orçamentárias ...";;Angelo Vanhoni;PR;PT;05/12/2011;;/proposicoesWeb/fichadetramitacao?idProposicao=529949
SBT 1 PL803510 => PL 8035/2010;1 COMISSÃO ESPECIAL DESTINADA A PROFERIR PARECER AO PROJETO DE LEI N.º 8.035, de 2010 ? PLANO NACIONAL DE EDUCAÇÃO PROJETO DE LEI No 8.035, DE 2010 Aprova o Plano Nacional de educação para o decênio 2011-2020 e dá outras providências Autor: PODER EXECUTIVO Relator: Deputado ÂNGELO VANHONI I ? RELATÓRIO A Presidente da República, por meio da Mensagem n.º 701/2010, apresentada em 20/12/2010 ao Congresso Nacional, submeteu à deliberação deste Parlamento o texto do Projeto de Lei ...;;Angelo Vanhoni;PR;PT;05/12/2011;;/proposicoesWeb/fichadetramitacao?idProposicao=529945
EMC 1799/2011 PL803510 => PL 8035/2010;Aprova o Plano Nacional de Educação para o decênio 2011-2020 e dá outras providências.;;Hugo Leal;RJ;PSC;07/06/2011;;/proposicoesWeb/fichadetramitacao?idProposicao=506916
PRL 1 CE => PL 512/2011;Parecer da Relatora, Dep. Alice Portugal (PCdoB-BA), pela aprovação.;;Alice Portugal;BA;PCdoB;10/10/2012;;/proposicoesWeb/fichadetramitacao?idProposicao=556781
PRL 1 CSSF => PL 512/2011;Parecer do Relator, Dep. Geraldo Resende (PMDB-MS), pela aprovação.;;Geraldo Resende;MS;PMDB;22/03/2012;;/proposicoesWeb/fichadetramitacao?idProposicao=538572
SBT-A 1 PL658313 => PL 6583/2013;Dispõe sobre o Estatuto da Família e dá outras providências.;;PL 6583/13 - ESTATUTO DA FAMÍLIA;;;08/10/2015;;/proposicoesWeb/fichadetramitacao?idProposicao=2017432
SBT 2 PL658313 => PL 6583/2013;COMISSÃO ESPECIAL DESTINADA A PROFERIR PARECER AO PROJETO DE LEI Nº 6.583, DE 2013 (Apenso o PL nº 6.584/13) Dispõe sobre o Estatuto da Família e dá outras providências. Autor: Deputado ANDERSON FERREIRA Relator: Deputado DIEGO GARCIA I ? RELATÓRIO Trata-se de Projeto de Lei, de autoria do ilustre Deputado Anderson Ferreira, que pretende instituir em nosso ordenamento jurídico o Estatuto da Família, para dispor sobre os direitos da família e estabelecer diretrizes de políticas ...;;Diego Garcia;PR;PHS;02/09/2015;;/proposicoesWeb/fichadetramitacao?idProposicao=1701684
PRL 4 PL658313 => PL 6583/2013;"Parecer do Relator, Dep. Diego Garcia (PHS-PR), pela constitucionalidade, juridicidade e técnica legislativa; e, no mérito, pela aprovação deste, e da Emenda 1/2014 apresentada ao projeto, com substitutivo; pela constitucionalidade, juridicidade e técnica legislativa; e, no mérito, pela rejeição do PL 6584/2013, apensado; e pela inconstitucionalidade e juridicidade, e, no mérito, pela rejeição da Emenda 1/2015, apresentada ao Substitutivo.";;Diego Garcia;PR;PHS;23/09/2015;;/proposicoesWeb/fichadetramitacao?idProposicao=1756982
PRL 2 PL658313 => PL 6583/2013;"Parecer do Relator, Dep. Diego Garcia (PHS-PR), pela constitucionalidade, juridicidade e técnica legislativa deste, do PL 6584/2013, apensado, e da Emenda 1/2014; e, no mérito, pela aprovação deste e da Emenda 1/2014, com substitutivo, e pela rejeição do PL 6584/2013, apensado.";;Diego Garcia;PR;PHS;01/09/2015;;/proposicoesWeb/fichadetramitacao?idProposicao=1701223
PRL 7 CSSF => PL 166/2011;Parecer da Relatora, Dep. Flávia Morais (PDT-GO), pela aprovação do PL 166/2011, do PL 1911/2011, do PL 4024/2015, e do PL 5745/2016, apensados, com substitutivo.;;Flávia Morais;GO;PDT;05/08/2016;;/proposicoesWeb/fichadetramitacao?idProposicao=2093056
SBT 1 CSSF => PL 7119/2017;Confere nova redação ao artigo 1520 da Lei 10.406 de 10 de janeiro de 2002, de modo a suprimir as exceções legais ao casamento infantil.;;Carmen Zanotto;SC;PPS;10/11/2017;;/proposicoesWeb/fichadetramitacao?idProposicao=2162230
PRL 1 CMULHER => PL 6/2015;Parecer da relatora, Dep. Laura Carneiro, pela aprovação.;;Laura Carneiro;RJ;PMDB;23/03/2017;;/proposicoesWeb/fichadetramitacao?idProposicao=2126997
PRL 1 CMULHER => PL 166/2011;Parecer da relatora, Dep. Professora Dorinha Seabra Rezende, pela aprovação do projeto de lei nº 166/2011 e dos PLs nº 1.911/2011, 4.024/2015, e 5.745/2016, apensados, nos termos do Substitutivo da Comissão de Seguridade Social e Família.;;Professora Dorinha Seabra Rezende;TO;DEM;02/05/2017;;/proposicoesWeb/fichadetramitacao?idProposicao=2132766
EMR 1 CSSF => PL 6/2015;Fica instituída a Semana de Orientação sobre a Gravidez na Adolescência, na primeira semana de maio.;;Elizeu Dionizio;MS;PSDB;27/09/2017;;/proposicoesWeb/fichadetramitacao?idProposicao=2153260
EMC-A 2 CSSF => PL 6/2015;"Altera o art. 2º do PL 6/2015, para incluir a expressão ""acompanhamento pré-natal"".";;SEGURIDADE SOCIAL E FAMÍLIA;;;28/09/2017;;/proposicoesWeb/fichadetramitacao?idProposicao=2153427
PRL 3 CSSF => PL 7119/2017;Parecer da Relatora, Dep. Carmen Zanotto (PPS-SC), pela aprovação do PL 7119/2017 e pela rejeição do PL 7774/2017, apensado.;;Carmen Zanotto;SC;PPS;11/04/2018;;/proposicoesWeb/fichadetramitacao?idProposicao=2171416
Fonte:;Sistema ;;;;;;;
Data/Ho;13/09/2020 ;;;;;;;
Total de ;52;;;;;;;
