Câmara dos Deputados;;;;;;;;
PRL 1 CFT => PLP 245/2013;Parecer do relator, Dep. Edmar Arruda, pela não implicação da matéria em aumento ou diminuição da receita ou da despesa públicas, não cabendo pronunciamento quanto à adequação financeira e orçamentária e, no mérito, pela aprovação.;;Edmar Arruda;PR;PSC;09/09/2015;;/proposicoesWeb/fichadetramitacao?idProposicao=1715647
SBT 1 CSSF => PL 3405/2008;Estabelece a obrigatoriedade do Estado em oferecer exame psicológico em policiais civis e militares, policiais federais e agentes penitenciários que estiverem em atividade e dá outras providências.;;João Campos;GO;PRB;20/12/2016;;/proposicoesWeb/fichadetramitacao?idProposicao=2121845
PRL 1 CSSF => PL 3405/2008;Parecer do Relator, Dep. João Campos (PRB-GO), pela aprovação deste, do PL 3718/2008, do PL 6659/2009, do PL 6838/2013, e do PL 4119/2015, apensados, com substitutivo.;;João Campos;GO;PRB;20/12/2016;;/proposicoesWeb/fichadetramitacao?idProposicao=2121814
RLP 1 CFFC => PFC 40/2015;Relatório Prévio, Dep. Wilson Filho (PTB-PB), pelo arquivamento.;;Wilson Filho;PB;PTB;08/11/2017;;/proposicoesWeb/fichadetramitacao?idProposicao=2160669
EMR 2 CSSF => PL 2760/2015;Altera a redação do artigo 18 da lei de LEI Nº 8.429, DE 2 DE JUNHO DE 1992, que dispõe sobre as sanções aplicáveis aos agentes públicos nos casos de enriquecimento ilícito no exercício de mandato, cargo, emprego ou função na administração pública direta, indireta ou fundacional e dá outras providências.;;Conceição Sampaio;AM;PP;12/05/2017;;/proposicoesWeb/fichadetramitacao?idProposicao=2143501
PRL 1 CSSF => PL 5907/2016;Parecer do Relator, Dep. Misael Varella (DEM-MG), pela aprovação.;;Misael Varella;MG;DEM;14/09/2017;;/proposicoesWeb/fichadetramitacao?idProposicao=2151785
Fonte:;Sistema ;;;;;;;
Data/Ho;13/09/2020 ;;;;;;;
Total de ;159;;;;;;;
